195,5/22/2024,Closed,,Field,Shot gun 1 and couldn’t shoot gun 2. Switch read after attempting to shoot and had to skip gun 2. Brought 2 more barrels out and had to RBIH and shoot 1 cluster.,Josh Herbolb,,Cox 22F 7D,1,"Midland, TX",LynX,Control Fire,Inconclusive,Misfire,Inconclusive,SO#2597-PS-3372,"Set plug and shot gun 1. When attempting to shoot gun 2, the engineer said the current came up with voltage and didn’t break showing a short. After the first attempt she switch in gun 2 still reads he tried a second time and still read the switch after shooting and then proceeded to skip gun 2 and shoot the remaining clusters on the gun string. Once OOH gun 2 did not shoot. 2 extra barrels were sent to location and they RBIH with 2 clusters to have a spare and shot the 1 remaining cluster that was skipped. The det still read 56.1 ohms, the end plate and ground were tight and wiring was correct. The switch checked good with a blaster meter and no short circuit or metal shavings were found. The scotch locks and det was still installed and not tampered with and the misrun gun was taken back to KLX shop. We went and picked the misrun gun up at the KLX shop and brought it back, removed the mini bridge and there was no exposed metal and the mini bridge megged good. Nothing was found wrong with the gun or detonator.","The det still read 56.1 ohms, the end plate and ground were tight and wiring was correct. The switch checked good with a blaster meter and no short circuit or metal shavings were found. The scotch locks and det was still installed and not tampered with and the misrun gun was taken back to KLX shop. We went and picked the misrun gun up at the KLX shop and brought it back, removed the mini bridge and there was no exposed metal and the mini bridge megged good. Nothing was found wrong with the gun or detonator.",Inconclusive,,https://www.appsheet.com/image/getimageurl?appName=FieldServiceTracker-657421423&tableName=Incident&fileName=Incident_Images%2F05-22-2024%2014-24-09.Example.203131.png&appVersion=1.000984&signature=c1b0c0f7c31c076c7f26bc5b1a7d3b873c4859359d094129544d2a664edc53c0,https://www.appsheet.com/template/gettablefileurl?appName=FieldServiceTracker-657421423&tableName=Incident&fileName=Incident_Files_%2F05-22-2024%2014-24-09.Incident%20Report.180010.pdf&appVersion=1.000984&signature=6a16e797e22bb74cffbff1595400e39b43fea127b9aaa93420e03b0e9870a4fcfb5b961f00f45e65509ece330a6b2ce3,,,KLX-Midland,88,Eric Williams,Vital Energy,,,KLX Energy Services,mF3zPy37464myrdSyX7Dub,,
194,5/20/2024,Closed,,Facility,Questionable Bad Stem,,,,,"Williston, ND",XC,XFire,Inconclusive,Misrun,Inconclusive,SO#,Brian Moyer lost switches below gun 5. He had to run back in to shoot the stage. They did not have any issues after this. 0 NPT,"I was given the switch from gun 4 to test. All the tests ran passed. It could have been the switch above, a bad bulkhead, metal shaving, etc. Inconclusive",n/a,https://www.appsheet.com/image/getimageurl?appName=FieldServiceTracker-657421423&tableName=Incident&fileName=Incident_Images%2F05-22-2024%2014-13-05.Evidence.192025.jpg&appVersion=1.000984&signature=6ee715261c255415876cba34c7467c117d131758978f04bd6001500b7c331b6d,,,,,SRF-Williston,87,Kelly Sullivan,Kraken Operating,,,"Surefire Wireline West, LLC",mF3zPy37464myrdSyX7Dub,,
193,5/19/2024,Closed,,Field,Detonator Failure,Jeremy Ruffin,,Micheal Ryan 223H,32,"Midland, TX",LynX,Control Fire,No,Misfire,Yes,SO#2565,The detonator resistor had gone off but the detonator had not.,Found det resistor had gone off but not the det,Further Investigate,https://www.appsheet.com/image/getimageurl?appName=FieldServiceTracker-657421423&tableName=Incident&fileName=Incident_Images%2F05-20-2024%2012-55-57.Evidence.175945.jpg&appVersion=1.000984&signature=385d60ae1ac51219e2b8d6eada42c341ca759c863462bf9cd47bb603b257c5cf,,https://www.appsheet.com/template/gettablefileurl?appName=FieldServiceTracker-657421423&tableName=Incident&fileName=Incident_Files_%2F05-20-2024%2012-55-57.Incident%20Report.201022.pdf&appVersion=1.000984&signature=b81e64af6f71a85d01aeb58558392420b45130091d824067884619ba12e3f66ec30e23d34b95b887041c38ada9cd14d2,,,KLX-Midland,83,Chris Hawthorne,Matador Resources Company,Austin Powder Company,Detonators - A140S,KLX Energy Services,7vRibsPobT4GuNdhpITrC4,,
192,5/14/2024,Closed,,Facility,Bad Mini Bridge DSC 9/8/23,,,,n/a,"Williston, ND",XC,XFire,Yes,Surface,Yes,SO#,No deto detected with surface test box. Purple wire of the mini bridge meters open.,An open is found when metering through the purple wire of the mini bridge. This was found to be a problem during manufacturing with the bullet terminal of a different DSC.,Xconnect has changed the style of the internal wire connection being done. This will eliminate the problem with new inventory.,https://www.appsheet.com/image/getimageurl?appName=FieldServiceTracker-657421423&tableName=Incident&fileName=Incident_Images%2F05-16-2024%2009-35-28.Evidence.144253.jpg&appVersion=1.000984&signature=725042bab1ac7e06b55c9d996ff0aede52d6382ceafe142d03647b2b922ccd17,,,,,SRF-Williston,,Kelly Sullivan,Kraken Operating,,"XC Bridged Mini Bulkheads 4"" ASM","Surefire Wireline West, LLC",7vRibsPobT4GuNdhpITrC4,,
191,4/23/2024,Closed,,Facility,Bad Single Stem. No Deto Detected.,,,,n/a,"Williston, ND",XC,XFire,Yes,Surface,Yes,SO#,A new XFire single stem shows no deto detected. This was caught in the trailer on the test box.,"Switch stem 633B was brought to the XConnect facility for investigation. The stem meters correctly. I then
hooked it up and shot through the stem and saw voltage at the detonator terminal.

After that I hooked up a 50-ohm resistor to the detonator lead and still saw No Deto detected. I saw the
same thing with an older version of the firmware. I also had No Deto detected with a surface test box.

Lastly, I shot through the switch and the resistor burned. This tells me the switch is working, but something is wrong with the deto detection on the switch.

After talking with our supplier, there is a ""resistance threshold"" that the detonator detection is based on. It
is possible one of the resistors on the switch board is reading higher than it should and this is causing the
improper reading.","Our supplier is going to get with his engineering team to try and understand how this happened. Continue
to monitor with the surface test box.",https://www.appsheet.com/image/getimageurl?appName=FieldServiceTracker-657421423&tableName=Incident&fileName=Incident_Images%2F05-16-2024%2009-12-49.Evidence.142102.jpg&appVersion=1.000984&signature=18a454e67e2f37a08d960292942e1a0ce0859cf2be7ad3712a0c02f355464532,https://www.appsheet.com/image/getimageurl?appName=FieldServiceTracker-657421423&tableName=Incident&fileName=Incident_Images%2F05-16-2024%2009-12-49.Example.142102.jpg&appVersion=1.000984&signature=b7a68e91b63d7c522a396f7daf362b87024ea4cb666e11f651cd6aa1ac54a9be,,,,GOW-Williston,,Kelly Sullivan,Chord Energy Corp,Advanced Wireline Solutions Inc,XC XFire Stem - Single ASM,Go Wireline LLC,7vRibsPobT4GuNdhpITrC4,,
190,5/13/2024,Closed,,Facility,GO Wireline encountered a Misrun at Plug Shoot Depth due to not being able to inventory all switches in the string. XC was notified of the failure and obtained the Stem in question. XC was notified that the Stem had a total of 8 successful runs prior to its failure. There were no marks or indicators on the stem to verify.,,,,,"Williston, ND",XC,XFire,Inconclusive,Misrun,Yes,SO#,GO Wireline encountered a Misrun at Plug Shoot Depth due to not being able to inventory all switches in the string. XC was notified of the failure and obtained the Stem in question. XC was notified that the Stem had a total of 8 successful runs prior to its failure. There were no marks or indicators on the stem to verify.,"Upon receiving the Stem a series of QC checks were performed.  • Verified the Ground Plungers were in working order. • Verified Ground continuity. (Fig1) • Observed Stem molding is free from cracks or air pockets • Verified Terminals were free of debris, and appear to be of correct size, indicating correct uninstall procedure. • Verified Thru terminal had no leakage to ground. • Verified Deto terminal had no leakage to ground. • Verified diode voltage drop, 0.48V. (Fig2) The switch was then connected the switch stem to an XFire panel and attempted to inventory. The switch would not verify in the system, Indicating an internal error in the switch board itself. It was then melted down to determine if it could be due to stem molding and terminal connection. All indications show that the terminal connections and wiring were adequate.  Switch will be sent to manufacturer for further diagnosis.",Switch will be sent to manufacturer for further investigation,,,https://www.appsheet.com/template/gettablefileurl?appName=FieldServiceTracker-657421423&tableName=Incident&fileName=Incident_Files_%2F05-15-2024%2020-12-04.Incident%20Report.021633.pdf&appVersion=1.000984&signature=2e9ff2e066c22f8d8b90a6ee8c465bdcbffb4448dab693ef2b8e2df54b0c0cb5a2f385408b076991e93913095bdc52ff,,,GOW-Williston,,Robert Grissom,Grayson Mill Energy,Advanced Wireline Solutions Inc,XC XFire Stem - Single ASM,Go Wireline LLC,,,
189,5/1/2024,Closed,,Field,Failed  Single Switch,N/A,,N/A,N/A,"Midland, TX",XC,XFire,Yes,Surface,Yes,SO#N/A,Failed Xfire Single-switch,Switch passed qc meter tests. When switch was connected to software it would not find switch. Single switch was melted down. No issues found with the molding process. Determined to be bad switch from AWS,Notify manufacturer,,,,,,TIER-Oklahoma,,Austin English,,Advanced Wireline Solutions Inc,XC XFire Switch,"Tier 1 Completions Solutions, Inc.",7vRibsPobT4GuNdhpITrC4,,
188,5/8/2024,Closed,,Facility,A single stem displayed a failure to register the detonator,N/A,,N/A,NA,"Midland, TX",XC,XFire,Yes,Surface,Yes,SO#,A single stem displayed a failure to register the detonator,"The stem underwent testing procedures at the Midland, TX office, including scanning and examination. Upon scanning, it was determined that the detonator circuit was defective. Subsequently, a simulated detonator was integrated and scanned, yielding identical outcomes—indicating the absence of a functional detonator. 
Notably, the stem was fired without the resistor burning.
The stem was melted and investigated internally.  No assembly or wiring issues were encountered",None at this time,https://www.appsheet.com/image/getimageurl?appName=FieldServiceTracker-657421423&tableName=Incident&fileName=Incident_Images%2F05-13-2024%2010-07-22.Evidence.151529.jpg&appVersion=1.000984&signature=0dc3a7e13fefeb1ee179cae0cf74a3f48ce1b425b35997b413f1e6453b99658b,,https://www.appsheet.com/template/gettablefileurl?appName=FieldServiceTracker-657421423&tableName=Incident&fileName=Incident_Files_%2F05-13-2024%2010-07-22.Incident%20Report.151529.pdf&appVersion=1.000984&signature=f231c7f93f04d839645aedca3d3839e6cbfa53c66f578770d201ff5e472b31d297792e04bbc2c685767b8fd74c23b404,,,TIER-Oklahoma,78,Max Killingsworth,Not Specified,Advanced Wireline Solutions Inc,XC XFire Stem - Single ASM,"Tier 1 Completions Solutions, Inc.",7vRibsPobT4GuNdhpITrC4,,
187,5/6/2024,Closed,,Field,"•	At 15:00, arrived on location and convened with Alex McKinnon, (FSM), to strategize regarding the operation and scheduling for the Rail system. Following a review of the ongoing operation's timeline, it was decided that XConnect would be implemented at 02:30.
•	Departed from the site at 15:30.
•	A call was received at 19:30, informing of Hunting's gun system communication failure, moving XConnect. to stage 40.
•	Returned to the site at 20:15 and initiated the assembly process for the 10-gun Rail system.
•	Installed the P1000 and conducted system diagnostics, subsequently proceeding with the descent into the well at 21:15. Executed a successful switch scan at a depth of 200', proceeding with the Running In Hole (RIH) process.
•	Following depth correlation, conducted a secondary scan.
•	Initiated pumping to the preset plug depth and commenced igniter firing. 
•	At 22:00, encountered an acceptable interruption in current flow; however, observed no indication of the plug's setting. 
•	A subsequent switch scan revealed the firing of gun one, prompting the Bottom Hole Assembly (BHA) to be POOH for investigative measures.","J. Vega, A. McKinnon,  J. Yapp",,622H,40,"Midland, TX",RAIL,XFire,Yes,Misfire,No,SO#,Dual switch wired incorrectly,"A visual inspection of the BHA determined that gun 1 fired and not the igniter. With the gun being fired, the dual switch was consumed, leaving no physical evidence to evaluate.",Assemble dual switch prior to deployment - for temporary use until the dual combo switches are in production,,https://www.appsheet.com/image/getimageurl?appName=FieldServiceTracker-657421423&tableName=Incident&fileName=Incident_Images%2F05-08-2024%2009-27-15.Example.144142.jpg&appVersion=1.000984&signature=c7399559473554209b11cb8dfa5d77c8f4c829454309af6fb5e43d71726ffed6,https://www.appsheet.com/template/gettablefileurl?appName=FieldServiceTracker-657421423&tableName=Incident&fileName=Incident_Files_%2F05-08-2024%2009-27-15.Incident%20Report.144142.pdf&appVersion=1.000984&signature=c15fdbb7d22bd7bdb8f0ea533e1e9bc980775e04c27897b301d891627c6128a7f102ed793ade3d1362c13d409ce9db48,,,STR-Midland,74,Max Killingsworth,,Suntronic Dallas LLC,XC XFire Switch,"Strata Wireline, LLC.",RdICtn14JR42MDLaiA6eja,,
186,4/23/2024,Closed,,Field,Couldn't shoot gun # 6. Short Circuit,,,,,"Midland, TX",XC,XFire,No,Misfire,No,SO#,DC nut backed out causing a short,Nut was not tightened in between runs,Have crew check assembly on each run,https://www.appsheet.com/image/getimageurl?appName=FieldServiceTracker-657421423&tableName=Incident&fileName=Incident_Images%2F04-23-2024%2009-16-15.Evidence.183242.jpg&appVersion=1.000984&signature=2bfc6b54c06271a850906b2825d9a1ab23efe5c6b973fc89aaab53a382adbf64,,,,,TIER-Midland,60,Max Killingsworth,,,RC Direct Connect Sub,"Tier 1 Completions Solutions, Inc.",RdICtn14JR42MDLaiA6eja,,
185,4/12/2024,Closed,,Field,Training for XFire system,"J. Witt, D. Alexander",,,,"Midland, TX",XC,XFire,No,Surface,No,SO#,Couldn't scan 21 switches,Dirty tandem subs prevented ground through the gun string. This prevented switch communication,Cleaned subs,https://www.appsheet.com/image/getimageurl?appName=FieldServiceTracker-657421423&tableName=Incident&fileName=Incident_Images%2F04-15-2024%2008-27-47.Evidence.172405.jpg&appVersion=1.000984&signature=54cf7254dfa0339caaba2d739bf7e368f653282f1f8dd38a3eff23444e16a529,https://www.appsheet.com/image/getimageurl?appName=FieldServiceTracker-657421423&tableName=Incident&fileName=Incident_Images%2F04-15-2024%2008-27-47.Example.172405.jpg&appVersion=1.000984&signature=040253d82588261a6b83012014c0ee5dc4324ad74e6d961fc55dd38e1ae94fa9,https://www.appsheet.com/template/gettablefileurl?appName=FieldServiceTracker-657421423&tableName=Incident&fileName=Incident_Files_%2F04-15-2024%2008-27-47.Incident%20Report.172405.pdf&appVersion=1.000984&signature=32475404dbdb54114cf502e22407bcaa399754ffa8035ca31501958cc7a4e0ccd203ce0b0aff47e46c8d9b0b9186815c,,,TIER-Oklahoma,55,Max Killingsworth,89 Energy,,RC Direct Connect Sub,"Tier 1 Completions Solutions, Inc.",C4LX4oovRW4HIxLnk4BTj0,,
184,4/9/2024,Closed,,Facility,Top Rail Gun had Pinched Thru Wire. Resulting in a Misrun,,,,,"Williston, ND",RAIL,Nextier,Yes,Misrun,No,SO#,NexTier suffered a misrun after deploying to 200’ and initiating an inventory check on the gun string. Multiple attempts were made with intermittent success to obtain a full and consistent inventory. The call was made to pull the gun string out of the well.,"It was observed that the top gun in the string had a Thru-Wire pinched between the det cover and the ballast (Fig1). The switch has wires coming from both ends, the white was folded back and over itself creating a tighter fit when installing the cover. Green line indicates the correct pathway to be followed","•	Discussion with the buid team and personnel in charge of the QC process, ensuring all steps are followed and if revisions need to be made to the process.
•	XConnect has a new Rail Cover in production and new Wire Strap in production",https://www.appsheet.com/image/getimageurl?appName=FieldServiceTracker-657421423&tableName=Incident&fileName=Incident_Images%2F04-10-2024%2009-30-22.Evidence.143257.png&appVersion=1.000984&signature=e4a9d2b88dfceabb0d740c2aa807904c902320573eb711904fc07635f90d732a,https://www.appsheet.com/image/getimageurl?appName=FieldServiceTracker-657421423&tableName=Incident&fileName=Incident_Images%2F04-10-2024%2009-30-22.Example.143257.png&appVersion=1.000984&signature=75892d5545f7e9ed21078fd82b1587182a7b6c5a47e002065d471d2a496a64c9,https://www.appsheet.com/template/gettablefileurl?appName=FieldServiceTracker-657421423&tableName=Incident&fileName=Incident_Files_%2F04-10-2024%2009-30-22.Incident%20Report.143257.pdf&appVersion=1.000984&signature=98b726f10c6e625c6811d5ec9825942791e49ab3f91445cf1f849281e5d2452d7e1b797fa88d01ac0eb2c7ed113aa7eb,,,NXT-Williston,,Robert Grissom,,,,NexTier Completion Solutions,Rucip2K5JK4KUCKXIG_lke,,
183,4/3/2024,Closed,,Facility,"1-5/8""x1-7/8"" Universal Adapter Cutting QC O-Rings",,,,,"Williston, ND",RAIL,Nextier,Yes,Surface,Yes,SO#,Crew had noticed O-Rings were being cut on their Quick Change while they were installing into the Universal Adapter.,Adapters in question were brought back to the facility as well as the current inventory stock and were isolated for QC checks. The operations team took multiple Direct Connect Quick Changes and Universal Adapters and threaded them together in attempt to recreate the issue. All three adapters failed the check due to creating damage to the O-Rings on the Quick Change. It was noticed that the hole machined for the Set-Screw had a sharp edge instead of a bevel/chamfer at the transition. It was noticed that the O-ring would catch at this point of the sharp edge of the hole and would create the damage in question.,Operations team manually cleaned up the sealing surface and the transition into the Set-Screw hole allowing for a smooth surface for the O-Ring to install into.,https://www.appsheet.com/image/getimageurl?appName=FieldServiceTracker-657421423&tableName=Incident&fileName=Incident_Images%2F04-03-2024%2011-44-37.Evidence.172057.jpg&appVersion=1.000984&signature=b377b2e62aa9e80337a73a7e5e43ba21c72f075b99b161a67d28c644bae8dee5,,,,,NXT-Williston,,Robert Grissom,Continental Resources,Expetro Energy Services Co Ltd,"XC Quick Change Hunting Adapter 1-5/8"" - 1-7/8""",NexTier Completion Solutions,7vRibsPobT4GuNdhpITrC4,,
182,4/2/2024,Closed,,Field,3/180 loaded as 3/120,,,,,"Williston, ND",XC Oriented,Control Fire,Yes,Surface,No,2480,2 shot barrels were found on location loaded as 3/120 when they should have been 3/180,"This made it through our assembly, Go's load team, and the field personnel. It has been discussed with the XC team.","This made it through our assembly, Go's load team, and the field personnel. It has been discussed with the XC team.",,,,,,GOW-Williston,,Kelly Sullivan,Chord Energy Corp,,,Go Wireline LLC,C4LX4oovRW4HIxLnk4BTj0,,
181,3/29/2024,Closed,,Field,Deto not clicked into det cord cover,,,,,"Midland, TX",RAIL,Control Fire,No,Misfire,No,SO#,"I believe this is an example of what happens when the det is not clicked into the det cord cover. 
@Derik Arnold
, if you talk to the guys out there, can you let them know the det needs to be clicked in?
Its possible the ears broke, but not something we have seen yet",Deto not clicked into det cord cover,Train personnel,https://www.appsheet.com/image/getimageurl?appName=FieldServiceTracker-657421423&tableName=Incident&fileName=Incident_Images%2F03-29-2024%2009-40-57.Evidence.144349.jpg&appVersion=1.000984&signature=aa88cd1536ea74054197d369a76e3333dfb6f45d63686c1f840291ca22d775f9,,,,,TWG-Windsor,,Austin English,Chevron Corp,,,The Wireline Group,RdICtn14JR42MDLaiA6eja,,
180,3/28/2024,Closed,,Field,"Was on location training new night engineer Brandon Cass. On stage 12 of the Shoeless 78 Tan well the top gun would not fire. 1st attempt showed the current come up but switch and det still showed after scan. 2 more attempts made but did not see current on second two attempts but the switch and det still showed up. Once OOH, we found they had scotch locked the det to itself and scotch locked the purple bridges mini wire to the red ground wire. They did have to RBIH and shoot the remaining cluster to complete the stage.",Brandon Cass,,Shoeless 78 Tan well Stage 12,12,"Midland, TX",XC,XFire,No,Misrun,No,SO#,Day crew gun left for night shift. The top gun would not shoot. First attempt he got current but switch was still there. Two attempts to fire the top gun (4) were made but no current on titan panel or shot plot but the GUI showed the detonator was still there and well as the switch like it was shorted.,The crews are all familiar with the process and proper procedures just human error failure more than likely from taking short cuts. I did show the company man and engineer the new design det connection we intend to go to in the future that would have eliminated this problem even though it shouldn’t have happened anyway.,"Guys need to double check everything and follow best practices and meter the detonator resistance through the pin after the det is installed. Also, the new pin wire connector dets that will be coming out would eliminate this misrun. Although they should still check resistance with new style detonators more than likely it wouldn’t have caused a misrun.",https://www.appsheet.com/image/getimageurl?appName=FieldServiceTracker-657421423&tableName=Incident&fileName=Incident_Images%2F03-28-2024%2023-57-29.Evidence.062044.jpg&appVersion=1.000984&signature=6ff52f1b9953970d348f7e846c3bec5ebbce44068a6e951efeefb7b76dc308c6,,,,,TWG-Grand Junction,38,Eric Williams,XCL Resources,,,The Wireline Group,RdICtn14JR42MDLaiA6eja,,
179,3/27/2024,Closed,Low,Field,Training. Sleeping Switch Event,,,,,"Midland, TX",XC,XFire,Yes,Misrun,Yes,SO#2479,Sleeping Switch,On Going,Changed stem out,https://www.appsheet.com/image/getimageurl?appName=FieldServiceTracker-657421423&tableName=Incident&fileName=Incident_Images%2F03-27-2024%2012-13-38.Evidence.172057.jpg&appVersion=1.000984&signature=8896e261482095c835e20de3e7ac8c0ecfd7f2d67da3cfcc14def86912539762,https://www.appsheet.com/image/getimageurl?appName=FieldServiceTracker-657421423&tableName=Incident&fileName=Incident_Images%2F03-27-2024%2012-13-38.Example.172057.jpg&appVersion=1.000984&signature=9ef9cda127d260965ac773fd8199c90847635c16189fd3d8193e4bb53f389f3e,,,,BWL-Farmington,,Max Killingsworth,"Enduring Resources, LLC",,XC XFire Switch,Basin Well Logging & Perforate,mF3zPy37464myrdSyX7Dub,,
178,3/16/2024,Closed,,Field,Pinched Through Wire.,,,,,"Williston, ND",RAIL,N/A,Yes,Surface,No,SO#2429,Pinched through wire between the ballast and det cover,Pictures were sent from the client,This has been addressed with the team and they lost bonus for the week.,https://www.appsheet.com/image/getimageurl?appName=FieldServiceTracker-657421423&tableName=Incident&fileName=Incident_Images%2F03-22-2024%2012-19-28.Evidence.175513.jpg&appVersion=1.000984&signature=6ed1829c6d10a0adbc2265c3de803031348093e85142467125956c5adcbd3331,,,,,NXT-Williston,,Kelly Sullivan,Continental Resources,,RL Detonator Cover,NexTier Completion Solutions,Rucip2K5JK4KUCKXIG_lke,,
177,3/19/2024,Closed,,Facility,Open through wire on end plate. Mini Bridge Yellow.,N/A,,N/A,,"Midland, TX",XC,XFire,Yes,Misfire,Yes,SO#2438,Open Det lead on Mini Bridge,Meter through the wire shows open.,Swap out endplates in the morning. Pull test from vendor. New crimp design.,https://www.appsheet.com/image/getimageurl?appName=FieldServiceTracker-657421423&tableName=Incident&fileName=Incident_Images%2F03-22-2024%2011-40-20.Evidence.164753.jpg&appVersion=1.000984&signature=0ba9d622de79c5ec9bc320c0c38f9aded412cc08d23d0daee607c6b4be39d8d8,,,,,TIER-Midland,,Austin English,Matador Resources Company,,"XC Bridged Mini Bulkheads 4"" ASM","Tier 1 Completions Solutions, Inc.",7vRibsPobT4GuNdhpITrC4,,
176,3/19/2024,Closed,,Facility,Crushed Charge Tube.,N/A,,N/A,,"Midland, TX",XC,Control Fire,Inconclusive,Surface,No,SO#2463,"Crushed charge tube. Likely something was in the barrel or sub that did not give enough room for charge tube to seat.
It’s possible that charge was out of spec but this would be unlikely to be this far out of spec.",It’s possible that charge was out of spec but this would be unlikely to be this far out of spec.,Notify field personnel to make sure sub is free of debris.,https://www.appsheet.com/image/getimageurl?appName=FieldServiceTracker-657421423&tableName=Incident&fileName=Incident_Images%2F03-22-2024%2011-00-40.Evidence.162012.jpg&appVersion=1.000984&signature=33654caa916115717472fd2a445067a99d61f721d645910bb03825d5ec45d969,,,,,TIER-Midland,,Austin English,US Energy Development Corporation,Expetro Energy Services Co Ltd,,"Tier 1 Completions Solutions, Inc.",RdICtn14JR42MDLaiA6eja,,
175,3/13/2024,Closed,,Field,RC Barrels from Hunt & Hunt did not thread together all the way with Tandem Subs.,ND_GO_GM,,,,"Williston, ND",ReConnect,XFire,Yes,Surface,Yes,SO#2449,Barrels would not meet the face of the tandem sub.,Thread Milling issue with Hunt and Hunt Manufacturer. MilSpec out of Range,"Get with Manufacturer on a resolution, Acquire more material from Main Vendor. Continue running H&H stock as well.",https://www.appsheet.com/image/getimageurl?appName=FieldServiceTracker-657421423&tableName=Incident&fileName=Incident_Images%2F190.Evidence.203145.jpg&appVersion=1.000984&signature=54da7e0d0cd2b15fcb7489d11d6ec4d74951b83d4e59a71cf77a6d0f410a3fcc,,,,,GOW-Williston,16,Robert Grissom,Grayson Mill Energy,,,Go Wireline LLC,7vRibsPobT4GuNdhpITrC4,,
