467,9/24/2025,Closed,Moderate,Field,Supervisor called and said he lost coms with lower guns,,,,,"Midland, TX",XC,XFire,No,Misrun,No,SO#,Lost communication below gun 16,switch in question was removed and reran prior to my arrival.  Further  testing will be conducted when a p2500 panel arrive. Tandem sub are not cleaned and thew stem seats have a buildup of rust and and debris,,https://www.appsheet.com/image/getimageurl?appName=FieldServiceTracker-657421423&tableName=Incident&fileName=Incident_Images%2F09-25-2025%2015-44-12.Evidence.214906.jpg&appVersion=1.000984&signature=691ed7ee9b2ee1d976127a239ef2af029c84ef56f667c272e9bd71dfe6d72cc8,https://www.appsheet.com/image/getimageurl?appName=FieldServiceTracker-657421423&tableName=Incident&fileName=Incident_Images%2F09-25-2025%2015-44-12.Example.214906.jpg&appVersion=1.000984&signature=4f726bd5283c93bc1df6f65fc7d5e9a3e9feb190b3ead289beac158246f29918,,,,TWG-Windsor,1132,Max Killingsworth,"Bayswater Exploration & Production, LLC",,XC Direct Connect Sub - Gen 2,The Wireline Group,RdICtn14JR42MDLaiA6eja,,
466,9/23/2025,Closed,Moderate,Field,"Investigate misrun on RAIL. A pinched wire was found, Damage was caused by the det cover pinching the white conductor.",,,,,"Midland, TX",RAIL,Control Fire,Yes,Misrun,No,SO#,Supervisor attempted to set plug and gun three developed a short. he tried fix wiring without success. POOH. Found damaged white wire caused by the det cover,see photo,Tested switch and found it was operational.  We were unable to fire through the switch due to lack to surface panels,https://www.appsheet.com/image/getimageurl?appName=FieldServiceTracker-657421423&tableName=Incident&fileName=Incident_Images%2F09-24-2025%2010-03-15.Evidence.152257.jpg&appVersion=1.000984&signature=db250a47f06f5f6866d322dfcefb27369ab09a3b74c4a50d709e537dbcbe92a7,,https://www.appsheet.com/template/gettablefileurl?appName=FieldServiceTracker-657421423&tableName=Incident&fileName=Incident_Files_%2F09-24-2025%2010-03-15.Incident%20Report.182901.pdf&appVersion=1.000984&signature=758c79880045e3c1b1103263802d8cfa741eeb01fd84ca7c08ad4c9954b2a250118d18720d8312b52bf9f72d5c37daff,,,TIER-Midland,1128,Max Killingsworth,Matador Resources Company,Advanced Wireline Solutions Inc,,"Tier 1 Completions Solutions, Inc.",C4LX4oovRW4HIxLnk4BTj0,,
465,9/19/2025,Closed,Low,Field,"9/18/25-Nine Charleroi Expand engineer called saying he lost communication to the perforating side of the P2500 and communication to perforation expert as well. He figured out it happened when he bumped the key with his hand while perforating. When he touched the key again he regained all communication. I offered to come out and swap panels for him but he declined saying he’d rather wait for the end of the pad. I reached out to his manager Mike Clark to make sure he was good with that and he said yes he was fine to wait.

9/19/25-The same engineer Jon Gulley called saying he was on surface and was unable to short out the line when checking fire. He was not able to get current after multiple attempts. I started troubleshooting with him and realized he had already tried to troubleshoot before calling including swapping out the DSP panel with his back up. He said both DSP’s were unable to show any current on the analog meter. This seems unlikely to be a DSP issue but hard to pinpoint without knowing what he did before calling. I tried having him meter the line, the coax, and the panel with a blasters meter but he said he could only get voltage and no current and said this was the same with the first DSP. While on my way to location his manager had him swap P2500 panels and the issue was resolved. I tried metering the first DSP to check for current but I believe there is not enough resistance in the blasters meter, and once voltage is applied to the meter, the panel shuts down. Grabbed the P2500 (loose key connection) and the first DSP to send to Hasan. 

I imagine the DSP is fine and the engineer had another issue going on that was inadvertently solved when swapping the P2500 but it would be good to get a report from Hasan on this one as Nine is slightly skeptical of the hardiness of the panels.",Nine/Days/Expand/Gulley,,210,,"Midland, TX",XC,XFire,Inconclusive,Surface,Inconclusive,SO#,"9/18/25-Nine Charleroi Expand engineer called saying he lost communication to the perforating side of the P2500 and communication to perforation expert as well. He figured out it happened when he bumped the key with his hand while perforating. When he touched the key again he regained all communication.

9/19/25-The same engineer Jon Gulley called saying he was on surface and was unable to short out the line when checking fire. He was not able to get current after multiple attempts","9/18/25-I offered to come out and swap panels for him but he declined saying he’d rather wait for the end of the pad. I reached out to his manager Mike Clark to make sure he was good with that and he said yes he was fine to wait.

9/19/25-I started troubleshooting with him and realized he had already tried to troubleshoot before calling including swapping out the DSP panel with his back up. He said both DSP’s were unable to show any current on the analog meter. This seems unlikely to be a DSP issue but hard to pinpoint without knowing what he did before calling. I tried having him meter the line, the coax, and the panel with a blasters meter but he said he could only get voltage and no current and said this was the same with the first DSP. While on my way to location his manager had him swap P2500 panels and the issue was resolved. I tried metering the first DSP to check for current but I believe there is not enough resistance in the blasters meter, and once voltage is applied to the meter, the panel shuts down.",Grabbed the P2500 (loose key connection) and the first DSP to send to Hasan.,,,,,https://xconnecthq.slack.com/archives/C02CST5QZC3/p1758323619553089,NES-Ulster,,Theo Morris,,Advanced Wireline Solutions Inc,XC XFire Communication Panel - P2500,"Nine Energy Service, Inc.",mF3zPy37464myrdSyX7Dub,,
464,9/13/2025,Closed,Moderate,Field,"Pick up detonator from low order, update panels, and test boxes","Howard Spencer, Kerry Hendrickson",,Corngstone 301H,Stage 1,"Midland, TX",XC,XFire,No,Misfire,Pending Investigation,SO#,Gun 7 had to be skipped  due to Detonator low ordering.,Pending 3rd party investigation report.,Detonator will be sent to Austin Powders,https://www.appsheet.com/image/getimageurl?appName=FieldServiceTracker-657421423&tableName=Incident&fileName=Incident_Images%2F09-14-2025%2020-12-43.Evidence.014646.jpg&appVersion=1.000984&signature=cfd10627577d200a9d67c973c0834e53dca1cf1ccbc5d9df2b11fef3a3064f93,,,,,TIER-Midland,1106,Larry Beaver,,Austin Powder Company,Click-In Detonator - A140 (XConnect) ASM,"Tier 1 Completions Solutions, Inc.",7vRibsPobT4GuNdhpITrC4,,
463,9/14/2025,Closed,Moderate,Field,Crushed igniter. Couldn’t shoot open to igniter.,Jeff,,Eckley 205H,29,"Midland, TX",XC,Control Fire,No,Misrun,No,SO#,Got to bottom and couldn’t set the plug. Open circuit to igniter.,A piece of plastic from the previous run igniter was broken off and left in the firing head which prevented the igniter from seating all way to the top. The new igniter was then smashed when the retainer nut was installed.,Crews instructed to make sure the bore hole in the firing head is clean and free of debris before installing a new igniter.,https://www.appsheet.com/image/getimageurl?appName=FieldServiceTracker-657421423&tableName=Incident&fileName=Incident_Images%2F09-14-2025%2020-51-53.Evidence.010144.jpg&appVersion=1.000984&signature=be9c5e3af1fbefe8926ba7d22509edcf21a4a65fbb4657309a442c95aaa0414d,,https://www.appsheet.com/template/gettablefileurl?appName=FieldServiceTracker-657421423&tableName=Incident&fileName=Incident_Files_%2F09-14-2025%2020-51-53.Incident%20Report.012247.docx&appVersion=1.000984&signature=9188764a898b55e6df8f4a8eb547ede57c85ff991e90e79fd75efeb080c2f1f34f5161a9800e52532411d228c7556d9c,,,NES-Marietta,,Eric Williams,EOG Resources,Diamondback Industries,Ignitors - Xferno ASM,"Nine Energy Service, Inc.",RdICtn14JR42MDLaiA6eja,,"HfZXBr2Tgs49UPBdq-L_Ea , bw8wytjLVY4n2Innsb8y4d"
462,9/11/2025,Closed,Low,Field,"Got a another call from GO Wireline, Same Devon Pad, Another Missrun. Same issue

Going to take out a new box of Stem switches to replace what they have on location",,,,,"Williston, ND",XC Oriented,XFire,No,Misfire,No,SO#,"A similar communication failure like event 459 and 460 occurred in a subsequent stage, with GO Wireline again reporting loss of communication following gun firing. An XConnect SQM was dispatched to investigate.","During inspection, it was discovered that GO Wireline had swapped out wireline units at some point prior to these events. The replacement unit was operating with a Probe Shooting Panel instead of the required Digital Shooting Panel. The Probe Shooting Panel is known to cause overcurrent conditions that damage AWS switches during firing sequences.","To resolve the issue, the Probe Shooting Panel was removed and replaced with the proper Digital Shooting Panel on the affected wireline unit. All Xfire AWS switches that had been exposed to the Probe Panel were pulled from service and replaced.",,,,,https://xconnecthq.slack.com/archives/C02CST5QZC3/p1757631324458539?thread_ts=1757631324.458539&cid=C02CST5QZC3,GOW-Williston,1094,Martin Aguilar,Devon Energy,,XC XFire Stem - FAST Single ASM,Go Wireline LLC,,,
461,9/11/2025,Closed,Moderate,Field,"GO Wireline lost communication with the bottom gun and plug while RIH, decision was made to POOH and swap guns. While POOH, gun reestablished connection. Gunstring was set aside for XC Investigation.",,,,,"Williston, ND",XC Oriented,XFire,No,Misrun,No,SO#,"GO Wireline reported an open-circuit communication issue during the initial communication check while running in hole. The combo switch (Gun 1 and Plug) could not be read, and the decision was made to pull out of hole (POOH). Upon coming out, full communication was re-established; however, the gunstring was still pulled to surface and set aside for XConnect Service Quality Manager (SQM) investigation.","The XC SQM fully disassembled Guns 1 and 2. All wiring was found to be in good condition, and all components metered within acceptable parameters. The root cause was identified as an improper ground between the stem of Gun 2 and its respective tandem sub. The ground contact surface inside the tandem sub was packed with blast debris and corrosion, which caused intermittent communication. This also explains why communication was re-established by the downward force of the gunstring while pulling out of hole. Xconnect SQM asked GO Wireline field personnel how often they clean the ground surfaces of the tandem subs and determined that it was not done frequently enough.",The XConnect SQM communicated to GO Wireline management and field personnel the importance of maintaining a clean contact surface to ensure proper continuity within the gunstring. They emphasizing that the ground contact surface within the tandem sub should be cleaned after every stage using a wire brush wheel to maintain reliable communication.,,,,,,GOW-Williston,1092,Martin Aguilar,Devon Energy,,XC Tandem Sub,Go Wireline LLC,C4LX4oovRW4HIxLnk4BTj0,,
460,9/10/2025,Closed,Critical,Field,GO Wireline called about a missrun the night prior. received short circuit during gun firing process,,,,,"Williston, ND",XC Oriented,XFire,No,Misrun,No,SO#,"GO Wireline reported a communication failure during a stage. After firing Gun 8, communication was lost with Guns 9 and 10. The GO Wireline Engineer attempted troubleshooting by sending positive voltage, which temporarily re-established communication with Gun 9. Gun 9 was successfully fired, but communication with Gun 10 was immediately lost thereafter. An XConnect Service Quality Manager (SQM) was dispatched to inspect the issue the following","GO Wireline personnel had identified a faulty stem switch as the suspected cause. The switch read correctly when tested individually, but during a deliberate short test it failed to display a switch address. Other switches identified properly before shorting. Further metering confirmed a leak between the ground port and outgoing signal (blue wire) and a dead short between incoming (white wire) and outgoing (blue) ports, whereas good switches measured ~11.45 MΩ

it was discovered that GO Wireline had swapped wireline units at some point and was using a Probe Shooting Panel instead of the recommended Digital Shooting Panel. The Probe Panel is known to create overcurrent conditions that damage AWS switches, and this was determined to be the ultimate root cause of all three incidents.",the Probe Shooting Panel was removed and replaced with the proper Digital Shooting Panel on the affected wireline unit. All Xfire AWS switches that had been exposed to the Probe Panel were pulled from service and replaced.,,,,,,GOW-Williston,1091,Martin Aguilar,Devon Energy,Advanced Wireline Solutions Inc,XC XFire Stem - FAST Single ASM,Go Wireline LLC,,,
459,9/11/2025,Closed,Moderate,Field,"Got a call from Go Wireline on Devon Energy. Missrun

Set plug, Shot 6 Guns, Received Short Circuit.",,,,,"Williston, ND",XC Oriented,XFire,No,Misrun,No,SO#,"Go Wireline reported a communication failure during a stage. After firing Gun 6, communication was lost with Guns 7, 8, and 9 out of a 10-gun string. An XConnect Service Quality Manager was immediately dispatched to conduct an inspection.","Upon arrival, XConnect SQM inspected Barrels 7 through 10 in detail. Guns 7, 8, and 10 showed no issues during testing. Gun 9 was seen to be the cause of the problem: the stem switch read correctly when tested alone, but when purposely shorted during testing, it failed to display a switch address prior to short circuit. In comparison, the other switches properly identified the switch address prior to being shorted. Further metering of the faulty stem against a new one revealed a small leak between the ground port and the outgoing signal (blue wire). Resistance readings also showed an issue, showing a dead short between Incoming signal port (White wire) and outgoing signal port (Blue Wire), whereas known good switches measured approximately 11.45MΩ.

it was discovered that GO Wireline had swapped wireline units at some point and was using a Probe Shooting Panel instead of the recommended Digital Shooting Panel. The Probe Panel is known to create overcurrent conditions that damage AWS switches, and this was determined to be the ultimate root cause of all three incidents.",the Probe Shooting Panel was removed and replaced with the proper Digital Shooting Panel on the affected wireline unit. All Xfire AWS switches that had been exposed to the Probe Panel were pulled from service and replaced.,,,,,https://xconnecthq.slack.com/archives/C02CST5QZC3/p1757603234266649,GOW-Williston,,Martin Aguilar,Devon Energy,Advanced Wireline Solutions Inc,XC XFire Stem - FAST Single ASM,Go Wireline LLC,,,
458,9/4/2025,Closed,Moderate,Facility,Picked up two failed BRT Switches,,,,,"Midland, TX",RAIL,XFire,Yes,Surface,Yes,SO#,BRT switches only made a few runs before losing communication with switches below.,Similiar to previous incidents with runs made with Probe panel. Overvoltages seem to be damaging switches,Replacing Probe panel with DSP next week,,,,,,TWG-Windsor,1084,Robert Grissom,Chevron Corp,Advanced Wireline Solutions Inc,XC XFire Switch,The Wireline Group,7vRibsPobT4GuNdhpITrC4,,
457,9/5/2025,Closed,Low,Field,"Horizontal Fervo Miss Run

Shot all guns like normal and came out to det cord not installed in the  det cover on the first barrel.",,,,,"Midland, TX",RAIL,,Yes,Misfire,No,SO#,Shot all guns as normal. Came out of the hole and found barrel one did not fire but shot fine in the truck.,Upon investigation it was found the det cord was not installed in the det cover properly. Detonator was fired but did not transfer to det cord.,Install check list prior to guns being built.,https://www.appsheet.com/image/getimageurl?appName=FieldServiceTracker-657421423&tableName=Incident&fileName=Incident_Images%2F09-05-2025%2003-52-02.Evidence.003938.jpg&appVersion=1.000984&signature=0ff00d02b8b226d7d3f1b693d251c4dca67d3115688ed200fe24824a0ddc35c6,,https://www.appsheet.com/template/gettablefileurl?appName=FieldServiceTracker-657421423&tableName=Incident&fileName=Incident_Files_%2F09-05-2025%2003-52-02.Incident%20Report.003938.pdf&appVersion=1.000984&signature=9fd64acaecb9fa4f6c953aec54ac4f851af9fe7d0e9d712bfc88ec9f2ce04c7255c163c4d5c12b5b369eb4c9ea267abe,,https://xconnecthq.slack.com/archives/C02CST5QZC3/p1757044322339939,HWS-Irwin,,Rob Fogarty,Fervo Energy,,RL Detonator Cover,Horizontal Wireline Services,RdICtn14JR42MDLaiA6eja,,
456,8/31/2025,Closed,Moderate,Field,"After DSP installation, I watched a stage be completed. 
after firing guns 1-7 gun 8 detonator was open. fix wiring was performed and didn't fix the issue. gun 8 was skipped and the remaining guns were fired successfully",,,,32,"Midland, TX",XC,XFire,No,Misfire,No,SO#,TWG skipped a gun due to open.  String scanned multiple times RIH.  Shot first 7 and 8 went open.    Shot the remaining and a stage was called.   Det clip was not installed correctly.   I was told this was the second misfire with the det clip not completely engaged .,,Talked to the night crew about a pull test on the connector and they are taping the clip for extra insurance.,,,,,,TWG-Windsor,1067,Max Killingsworth,,Austin Powder Company,Click-In Detonator - A140 (XConnect) ASM,The Wireline Group,,,
455,8/29/2025,Closed,Moderate,Field,Investigation on gunstring communication error during initial RIH scan,,,,5,"Williston, ND",XC Oriented,XFire,No,Other,No,SO#,Short circuit after gun 6 during initial rih scan,Ground pin found to be backed off causing intermittent communication/short,Reminded crews of pre arming checks,,,,,,GOW-Williston,1052,Martin Aguilar,Devon Energy,,,Go Wireline LLC,p-coBH3UVo40iG0iwX6IF2,,
454,8/23/2025,Closed,Low,Field,"Caliber/Ovintiv/Wheeler/3H/STG 76

Caliber called they just had a misfire due to the green wire not being seated all the way in the molex connection. They did just skip it and shot the rest of the guns. Ovintiv called it a stage. This is a step that is shown by myself and others to check for but not always passed on when the crews teach each other. Maybe we could add this check to the training posters to go along with the pull test.",ovintiv/day,,3h,76,"Midland, TX",RAIL,XFire,Yes,Misfire,Yes,SO#,The engineer was unable to shoot gun 3 due to an open circuit at the detonator. The gun in question was skipped and the rest of the guns were shot. Ovintiv called it a stage.,The green wire was not fully seated in the molex connection.,"This step is already checked during the gun-building process. Unfortunately, it was missed.",https://www.appsheet.com/image/getimageurl?appName=FieldServiceTracker-657421423&tableName=Incident&fileName=Incident_Images%2F08-23-2025%2018-05-39.Evidence.141728.jpg&appVersion=1.000984&signature=bebacebafdaca9a51e587be8b471f77849a69c9d0cd91df7b16730ec115198b8,,,,https://xconnecthq.slack.com/archives/C02CST5QZC3/p1755972339428239,CCS-Oklahoma,,Mike Grober,Ovintiv USA Inc,Tri-V Tool & Mfg Co,,"Caliber Completions Services, LLC",7vRibsPobT4GuNdhpITrC4,,
453,8/21/2025,Closed,Low,Facility,"Tyler with Bonnetts called this morning unable to set a plug. He attempted to set the plug 7 times and agin with me on the phone. All switches read fine, he never had an error message, nor did he have intermittent communication at any point. The shot plots looked normal. Tyler explained that they had 40 runs on the plug switch and I explained that we recommend 16 runs and that he may not be able to set the igniter because the switch is damaged and not allowing current through. We tried troubleshooting a few more things and then they decided to pooh.

He called back on his second run and was unable to set the plug again. He said they checked their surface equipment and hardware as well as changed out the switch housing and the switch with a new one before RIH with the second attempt. Same as the first run they did not have any communication issues, they were able to see the detonators and igniter, shot plots seemed normal. Had him cycle the panels, reload the software, and he was never able to set the plug. Current on both runs were over .5 Amp up to 1.25 Amp and held for as long as 5 seconds.

On surface they megged the line and the slips with no issue. The igniter read 50.4 Ohms. He was able to apply 200V at the panel and read 199V at the cable head. Still working on trouble shooting with him.",Bonnett’s/Birchcliff/Tyler,,,,"Williston, ND",RAIL,XFire,Inconclusive,Misrun,Inconclusive,SO#,,,,,,,,https://xconnecthq.slack.com/archives/C02CST5QZC3/p1755810300664509?thread_ts=1755810300.664509&cid=C02CST5QZC3,BEC-Canada,,Theo Morris,,,,Bonnetts Energy Corp,mF3zPy37464myrdSyX7Dub,,
452,8/3/2025,Closed,Low,Facility,Tier 1 had a misrun caught at 200ft. White wire had insulation scraped off near the RTV. This was likely caused in the manufacturing of the switch. Will let Hasan know.,,,,,"Midland, TX",RAIL,XFire,Yes,Misrun,Yes,SO#,Tier 1 had a misrun caught at 200ft. White wire had insulation scraped off near the RTV.,Seems to have likely been casue during manufacturing.,Inform Manufacurer,https://www.appsheet.com/image/getimageurl?appName=FieldServiceTracker-657421423&tableName=Incident&fileName=Incident_Images%2F08-03-2025%2001-14-45.Evidence.202406.jpg&appVersion=1.000984&signature=ac0b5a6c226fa39c020af7d194e37e35dd08f81983691cd91bc69813b29acb71,,,,https://xconnecthq.slack.com/archives/C02CST5QZC3/p1754183685534469?thread_ts=1754183685.534469&cid=C02CST5QZC3,TIER-Midland,,Austin English,,Advanced Wireline Solutions Inc,XC XFire Switch - Fast,"Tier 1 Completions Solutions, Inc.",7vRibsPobT4GuNdhpITrC4,,
451,8/19/2025,Closed,,Field,"Liberty Wireline / Murfin Drill Co. / MH Hecker Pad

Arrived on location to troubleshoot three RAIL guns that were not reading on surface. Broke down and inspected each associated carrier and tandem sub. Identified one carrier that would read in but not out. The switch was replaced, and the guns were reassembled. All switches then read correctly both individually and in line.

It is unclear what troubleshooting steps the day crew attempted prior to my arrival. Only one of the three barrels had an actual issue, which suggests the guns may have been set aside as soon as they failed to read.

The failed switch has been pulled and will be taken back to the shop for further review.

No Wireline NPT incurred. Operations normal.",,,,,"Williston, ND",RAIL,XFire,Yes,Surface,Pending Investigation,SO#,"Liberty Energy reported communication issues with three XConnect RAIL perforating barrels that
would not interface with the XC surface testing box. Liberty Wireline representatives isolated the
affected barrels and set them aside for inspection by the XConnect Service Quality Manager
(SQM).","Upon arrival, the XConnect SQM inspected the three reported barrels. Each associated carrier
and tandem sub was broken down and visually examined for defects, and all wiring was metered
to confirm proper continuity.
The investigation determined that only one carrier was at fault. The Addressable XFire switch
within that carrier was able to receive a signal, but failed to transmit an outgoing communication
signal, indicating an internal failure of the switch.","The faulty switch was removed and replaced. All three carriers were then reassembled and
successfully tested both individually and inline. Each demonstrated proper communication
functionality. Liberty Wireline personnel observed the repair and verified the retesting results.",,,,,https://xconnecthq.slack.com/archives/C02CST5QZC3/p1755659931609209?thread_ts=1755659931.609209&cid=C02CST5QZC3,LES-Platteville,1029,Martin Aguilar,Murfin Drilling Company,,RL XFire FAST Switch - Wired Harness 3/5 ASM,Liberty Energy Inc.,,,
450,8/20/2025,Closed,,Field,"Caliber/Ovintiv/Wheeler/3H/STG 58

Larry called this morning and said that Jake (engineer) reached out to him. He set the plug and was only able to detect the release tool switch. They did some troubleshooting but were not able to get all of the switches back. I got ahold of Jake, they were able to get some switches back while pulling out of the well but it was very sporadic. May get all switches then only pick up 5 or 2 guns. He said on surface they were able to read the RT switch and all of the guns. So they just broke off the top gun and release tool and ran the remaining 8 guns again. ASF. I got to location and checked out the gun, tandem sub and top rail sub with the crew. There were no issues found. I spoke with Mason and he is in agreement that it is the release tool. As they have had similar issues in the past with the Titan RT banana pin coming loose.",Ovintiv/nights/jake,,3H,58,"Midland, TX",RAIL,XFire,No,Misrun,No,SO#,The engineer set the plug and was only able to detect the release tool switch. Some troubleshooting was done but they were not able to get all of the switches back. Some switches we’re detected while pulling out of the well but it was very sporadic. May get all switches then only pick up 5 or 2 guns. On surface they were able to read the RT switch and all of the guns. They just broke off the top gun and release tool and ran the remaining 8 guns again. ASF.,"On surface the gun, tandem sub and top rail sub were checked with the crew. There were no issues found.",Caliber’s management is in agreement that it is the release tool. As they have had similar issues in the past with the Titan RT banana pin coming loose.,,,,,https://xconnecthq.slack.com/archives/C02CST5QZC3/p1755694695710989,CCS-Oklahoma,1028,Mike Grober,Ovintiv USA Inc,,,"Caliber Completions Services, LLC",C4LX4oovRW4HIxLnk4BTj0,,
