Event ID,Date of Incident,Incident Status,Incident Severity,Field or Facility,Notes,Customer Rep/Crew/Fleet,Operator Representative,Well Name and #,Stage #,District providing material,XC Products Gun System,Firing System Being Used,Caused by XConnect,Event Category,Caused by Vendor,Sales Order #,Description of Incident,Investigation and Troubleshooting,Root Cause/Conclusion,Image1,Image2,Incident Report,Report Sent,Slack URL,Customer District,Field Visit ID,XC Representative,Operating Company,Vendor,Failed Component,Customer,Failure Type,Incident Summary,Related Images
572,5/26/2026,Open,Low,Field,"Horizontal Conoco:
Can't communicate bellow gun 2 on surface tester. Went over with them the possibility of combo being in gun due 2.75” stems being the same size he said the combos are painted and it's not the issue. Also went over if det isn't connected won't have read past. He's going to swap out top three guns and see if that works.",,,,,"Midland, TX","XC 2.75""",XFire,No,Surface,No,,XC was notified that crews were having difficulty getting successful scans on multiple gunstrings.,"XC SQM was deployed to location to diagnose and assist. Upon arriving on location, guns were dissasembled. SQM observed that the internal charge tubes were compressed, resulting in the bulkhead connection to the upper stem was disconnected. Barrel and Tandem subs were checked to identofy and obstructions. Nothing foreign was present. It was noticed that the tandem subs were very rusty and large signs of corrosion.","The buildup of rust/corrosionon the internal bore of the tandem sub, would prevent the sealing surface of the Bullkhead and more importantly the Top End Plate to move with adequate friction into the bore. This friction would cause the entire charge tube to be seated further down into the barrel, while assembling would create additional force that the charge tube can handle.",https://www.appsheet.com/image/getimageurl?appName=FieldServiceTracker-657421423&tableName=Incident&fileName=Incident_Images%2FLYZUgCRkLj4Ei5KwBe1Hr6.Image1.180444.jpg&appVersion=1.000984&signature=772ff54c24bfe6ff80f794c9c524e1d38354c7f0476f54768f31b2e753076a6f,https://www.appsheet.com/image/getimageurl?appName=FieldServiceTracker-657421423&tableName=Incident&fileName=Incident_Images%2FLYZUgCRkLj4Ei5KwBe1Hr6.Image2.180444.jpg&appVersion=1.000984&signature=d1d9ba109ba7b0e46c988d82ced22abaf2c4644d7cbb60ca884eca423e3350c5,,,https://xconnecthq.slack.com/archives/C02CST5QZC3/p1779591645578889?thread_ts=1779591645.578889&cid=C02CST5QZC3,,,Robert Grissom,ConocoPhillips,,,Horizontal Wireline Services,,"On May 26, 2026, a surface incident occurred involving Horizontal Wireline Services, affecting operations for ConocoPhillips. Crews experienced difficulty with gunstring scans. An investigation found compressed internal charge tubes and disconnected bulkhead connections, with the root cause determined to be rust and corrosion in the tandem subs preventing proper component seating.",
571,5/25/2026,Closed,Moderate,Field,"Liberty High Peak

Scanned a gun with truck and it showed a short below gun 1 and wouldn't read the plug switch but everything read good with the surface tester. 

Hooked up another gun and it won't read past gun 6 and shows short circuit. They called me at this point and I had them install FW 189 and scanned but still won't read past gun 6 and showing a short circuit below gun 6. They are coming off the well and swapping again.",Ryan,Charlie,Puckett A3HR,7,"Midland, TX",DSX,XFire,Yes,Misrun,Yes,,"Equalized ans opened well for stage 7. Before RIH switches were scanned and showed short at bottom of gun 1 and not reading the plug switch. Came off the well and picked up another gun. Stabbed back on, equalized, opened well and scan at 20ft in the hole showed short below gun 6. Engineer called XC rep while on the well and the Spartan logging panel was updated to Firmware 189. Switches were scanned again and still showing short below gun 6. Came back off and picked up a third gun and completed the stage.",Water entered in both gun 1 on the first attempt and water in gun 6 causing a ahort circuit.,Manufacturing machine shop defect. The keyway was machined all the way to the end of the barrel which allowed the water to enter the gun under the orings.,https://www.appsheet.com/image/getimageurl?appName=FieldServiceTracker-657421423&tableName=Incident&fileName=Incident_Images%2F3BrrYU8Ahl4BiNvf19xKI5.Image1.035545.jpg&appVersion=1.000984&signature=3a0f326fa57697c65f6781f0934b413e301f71aef6ddd7d9ccc8cf4bad45affc,,https://www.appsheet.com/template/gettablefileurl?appName=FieldServiceTracker-657421423&tableName=Incident&fileName=Incident_Files_%2F3BrrYU8Ahl4BiNvf19xKI5.Incident%20Report.201959.pdf&appVersion=1.000984&signature=6aee1f5aa7c3a2c389c0eaac1ca39335684f12a7edb4a00a5599db93a64b2de147c43cbd7e9bc1289c01c3dcf6f9e436,,https://xconnecthq.slack.com/archives/C02CST5QZC3/p1779649089420049?thread_ts=1779649089.420049&cid=C02CST5QZC3,LES-West Texas,,Eric Williams,HighPeak Energy,Varigate Technologies Inc.,,Liberty Energy Inc.,7vRibsPobT4GuNdhpITrC4,"A misrun incident occurred on May 25, 2026, for Liberty Energy Inc. (HighPeak Energy, LES-West Texas). The issue involved multiple gun failures due to short circuits caused by water ingress. The root cause was a product defect from a manufacturing machine shop error, where an incorrectly machined keyway allowed water to enter the guns.",
570,5/23/2026,Closed,Low,Field,"Caliber/Sabalo
Ran in hole to target depth set plug and shot guns 1-7 after shooting gun 7 he was not able to see BRT( need to confirm this statement about BRT) or gun 8 any more, tried to get it back with success and was able to and pumped back down to try and shoot the last gun and lost communication again, came out of the hole and laid gun down. With test box the tool read fine, Caliber's Fsm Went through the top gun and BRT and could not find anything, Eric is going to stop there and try to retrieve Brt switch and see what he can figure out on his way back to midland. This happened early this morning. Was waiting to hear back with outcome but never did had to call around and get information. This created the delay in posting.,",Na,,Desert Rose 1JM,12,"Midland, TX",RAIL,XFire,No,Misfire,No,,Made it to plus depth. Set plug and shot guns 1-7 then lost communication with BRT and top gun 8. Pooh with 7/8 clusters and frac continued.,Nothing was found wrong with the BRT switch or gun 8. Caliber FSM had taken the BRT back to the shop before XC rep arrived.,Open circuit in BRT,https://www.appsheet.com/image/getimageurl?appName=FieldServiceTracker-657421423&tableName=Incident&fileName=Incident_Images%2FFrFt9vkIKa48unpCNZu2Ad.Image1.033827.jpg&appVersion=1.000984&signature=135e149ce623573443a5ac242240aacc9b287043bb6fc52b11fd3642670a5d1b,,,,https://xconnecthq.slack.com/archives/C02CST5QZC3/p1779553446823019?thread_ts=1779553446.823019&cid=C02CST5QZC3,CCS-Midland,1744,Eric Williams,Sabalo,,,"Caliber Completions Services, LLC",,"An incident categorized as a 'Misfire' occurred on May 23, 2026, involving Caliber Completions Services, LLC (Sabalo, CCS-Midland). The incident involved a loss of communication with the BRT and gun 8 after guns 1-7 were shot, with the root cause identified as an open circuit in the BRT. There was a delay in posting this incident report.",
569,5/23/2026,Open,Moderate,Field,"Tier 1 ? Coronado/ Oklahoma
Ran in hole set Plug and shot gun 1 after shooting gun 1 lost communication to gun 2 only gun 3 through 8 was available, I told them i was pretty sure gun 1 shot. They skipped gun 2 and shot remaining guns, FSM does not know if it was shorted or open circuit. Just speculating that problem was in the switch 3 that been shot and will not find an actual issue, but will do my best to see what i can find out. Heading that way.","Tavo Goosman, Chris Cook, Coby",Todd,Albi 13M,6,"Midland, TX",RAIL,XFire,Under Investigation,Misfire,Pending Investigation,,"Engineer ran in hole set plug and shot gun one. After shooting gun one communication was lost  to gun two, only guns three through eight  were available, Attempted to regain communication and failed to do so, Gun number two was skipped and successfully shot the remaining guns,","When BHA returned to surface gun two was removed. Gun two was then checked with surface tester and was showing time out. This represents open or not reading, The diode was then checked and the correct reading was displayed, After this point it was determined the switch had completely failed.","Complete Switch Failure. The Switch will be sent to Advance wireline solutions for testing and a complete failure report,",https://www.appsheet.com/image/getimageurl?appName=FieldServiceTracker-657421423&tableName=Incident&fileName=Incident_Images%2FHWmxTO7RDa4pAJD5jlC52d.Image1.052212.jpg&appVersion=1.000984&signature=2f23305088b829ce1b7bf30b75e733dbb24326a1ee19335d3cfa3660d585d1dd,https://www.appsheet.com/image/getimageurl?appName=FieldServiceTracker-657421423&tableName=Incident&fileName=Incident_Images%2FHWmxTO7RDa4pAJD5jlC52d.Image2.052212.jpg&appVersion=1.000984&signature=92cdf5080dbcf35b3f80882c9ef95360445e59f0c1085dc083e0b3e000abdcfc,https://www.appsheet.com/template/gettablefileurl?appName=FieldServiceTracker-657421423&tableName=Incident&fileName=Incident_Files_%2FHWmxTO7RDa4pAJD5jlC52d.Incident%20Report.140808.docx&appVersion=1.000984&signature=2a807dffb1908502112152e949d8b8a4aeb29d1837468e66aeeffa92244fbac6152c0bb0ace8ad88e497b4431c5fe3d6,,https://xconnecthq.slack.com/archives/C02CST5QZC3/p1779558260223059,TIER-Oklahoma,1743,Larry Beaver,Coronado Oil Company,Advanced Wireline Solutions Inc,RL XFire Switch - Wired Harness 3/5 ASM,"Tier 1 Completions Solutions, Inc.",mF3zPy37464myrdSyX7Dub,"On May 23, 2026, a misfire incident occurred during operations for Coronado Oil Company in the TIER-Oklahoma district, involving Tier 1 Completions Solutions. The incident involved a loss of communication to gun 2 after gun 1 was shot, leading to gun 2 being skipped. Investigation confirmed a complete switch failure in gun 2, which will be sent for testing and a full failure report.",
568,5/23/2026,Open,Moderate,Field,"KLX_Scout_SWM Guns/AWS Switch

Had a misfire. When firing Gun 3 current went directly to a short circuit. Apparently this is the second one in the past 2 weeks. Damon is going to get switches and detonators back to his shop and we will test them both out.",,,,,,,,Under Investigation,Misfire,Pending Investigation,,KLX suffered a misfire when attempting to shoot gun 3. Multiple attempts were made and a short cicuit was observed on the shot plot.,Switches and Detonators are being brought to KLX facility and we will perform additional testing. As of now the detonators have been metered and seem to be correct.,,https://www.appsheet.com/image/getimageurl?appName=FieldServiceTracker-657421423&tableName=Incident&fileName=Incident_Images%2FlzItld_aia4wup9-sVsE6a.Image1.215254.png&appVersion=1.000984&signature=a26eed66283797f423b856e1433126d5bedd9fedb320abbbdca43498ae184767,,,,https://xconnecthq.slack.com/archives/C02CST5QZC3/p1779562160355829?thread_ts=1779562160.355829&cid=C02CST5QZC3,KLX-Platteville,,Robert Grissom,Scout Energy Partners,Advanced Wireline Solutions Inc,,KLX Energy Services,,"On May 23, 2026, a misfire and short circuit occurred with Gun 3, which is the second such incident in two weeks involving the KLX_Scout_SWM Guns/AWS Switch. Switches and detonators will be tested.",
567,5/12/2026,Closed,Critical,Field,"TWG logos
Had a misrun due to wire being behind charge. While shooting the scotchlok finally broke causing loss of communication below this gun.",,,,,"Midland, TX",XC,XFire,Yes,Misrun,No,,While attempting to shoot remaining guns. an open circuit was detected,"Toolstring was deployed to surface and instpected. The Thru wire was placed behind a shape charge, causing tension in the wire and scotchlok connection. While shooting the tension casued the wire to break from the scotchlok connection",Ensure proper placement of feed thru wire during aseembly/loading. Team has been notified and instructed.,https://www.appsheet.com/image/getimageurl?appName=FieldServiceTracker-657421423&tableName=Incident&fileName=Incident_Images%2Fx0PaT1BRYX4bYFmqSHzuHb.Image1.154940.jpg&appVersion=1.000984&signature=3350ba599552a78f10ec79b109902d81b6df29748df9346a42c1409bcbd5e1dc,https://www.appsheet.com/image/getimageurl?appName=FieldServiceTracker-657421423&tableName=Incident&fileName=Incident_Images%2Fx0PaT1BRYX4bYFmqSHzuHb.Image2.154940.jpg&appVersion=1.000984&signature=5f2723e15354138bde37076a513b740d37fb47d319bdfa99fe14fe1e22923667,,,https://xconnecthq.slack.com/archives/C02CST5QZC3/p1778590369515359,,,Robert Grissom,Logos Energy,,,The Wireline Group,Rucip2K5JK4KUCKXIG_lke,"An incident occurred on May 12, 2026, involving The Wireline Group and Logos Energy. The event was categorized as a misrun, where an open circuit was detected while attempting to shoot remaining guns. This was caused by a wire being improperly placed behind a charge, leading to a broken connection. The team has been notified and instructed to ensure proper wire placement during assembly and loading to prevent recurrence.",
566,5/13/2026,Closed,Critical,Field,"From GO engineer on Scout in Utah. They have had a few do this they said
  During night shift testing of a loaded spent gun, the verifier box was unable to read the plug barrel despite multiple attempts.
The lead hand removed the plug barrel to investigate the issue. Once the switch cover was removed, the root cause was immediately apparent: the green wire was not connected to the switch connector.
Conclusion: The disconnected green wire prevented the plug barrel from registering a proper read on the verifier box.",,,,,"Williston, ND",RAIL,XFire,Yes,Caught by field personnel,Yes,,On Surface a combo switch was unable to read a detonator.,Det cover was removed and it was observed that the terminal had deseated from the molex connector.,Manufacturing defect noted prior. New clip will be installed in connectors going forward.,https://www.appsheet.com/image/getimageurl?appName=FieldServiceTracker-657421423&tableName=Incident&fileName=Incident_Images%2FmS4cW27Ofv4Wy4Ru1FVqD3.Image1.153955.jpg&appVersion=1.000984&signature=3684b0d17bdd59a660271d4a4aa6e84cfcccf82bfc0c2027e533baff803036dc,,,,https://xconnecthq.slack.com/archives/C02CST5QZC3/p1778681636925249,GOW-Williston,,Robert Grissom,Scout Energy Partners,Tri-V Tool & Mfg Co,RL XFire Combo Switch - Wired Harness 3/5 ASM,Go Wireline LLC,7vRibsPobT4GuNdhpITrC4,"On May 13, 2026, field personnel identified an incident where a combo switch on the surface failed to read a detonator. Investigation revealed a terminal had deseated from the connector, indicating a manufacturing defect. A new clip will be installed in connectors to prevent future occurrences.",
565,5/17/2026,Closed,Critical,Field,"Go / Devon

Got a call from Travis, he lost communication with switches 5-7 after shooting gun 4. 

Was able to talk him through some stuff and regain connection. They then proceeded to shoot gun 5, 6, and 7(not shot on surface), before they lost communication again

Heading out there to pull logs and inspect what I can",Travis Jenkins / Devon Fleet,,Forest 26-35 4H,19,"Williston, ND",XC Oriented,XFire,Yes,Misrun,Pending Investigation,,"After firing Gun 4 on Stage 19 of the Forest 26-35 4H, GO Wireline experienced a short circuit, resulting in a loss of communication with the remaining switches in the toolstring. GO Wireline management contacted XConnect in an attempt to reestablish communication through software adjustments. Communication was successfully regained, allowing the crew to fire Guns 5 and 6 before communication was lost again. At that point, the PIC made the decision to pull out of hole. XConnect was immediately dispatched to location to begin the investigation.","On Surface the spare barrel located at the top of the toolstring exhibited short circuit burn marks on the stem switch communication wire (white) port. The bottom end plate was removed and insulation testing with a megohmmeter indicated a leak path to ground. The mini bridge was then removed, confirming the leak was present along the beveled neck section of the insulator.","Investigation determined the loss of communication was caused by an electrical leak path to ground within the spare barrel located at the top of the toolstring. Inspection revealed short circuit burn marks at the stem switch communication wire (white) port, and further insulation testing confirmed the failure originated from the beveled neck section of the insulator.",https://www.appsheet.com/image/getimageurl?appName=FieldServiceTracker-657421423&tableName=Incident&fileName=Incident_Images%2FIkhxnXYngs4K616vL8P0h5.Image1.042342.jpg&appVersion=1.000984&signature=ebecf42320b183b9962171e53acd1d519dde0d60a070f9fceccf4e6fe2c6695a,https://www.appsheet.com/image/getimageurl?appName=FieldServiceTracker-657421423&tableName=Incident&fileName=Incident_Images%2FIkhxnXYngs4K616vL8P0h5.Image2.042342.jpg&appVersion=1.000984&signature=ddb722f61133172eb2a813038d4c13d1466509320f66f9d70e50b8376e57829c,https://www.appsheet.com/template/gettablefileurl?appName=FieldServiceTracker-657421423&tableName=Incident&fileName=Incident_Files_%2FIkhxnXYngs4K616vL8P0h5.Incident%20Report.042342.docx&appVersion=1.000984&signature=39954d61a48d097723675a12a9beed4851e445accba7419288a41033865e5c04ed9323d27fe4e273892e5b6ecb9b5c65,,https://xconnecthq.slack.com/archives/C02CST5QZC3/p1779049211203509,GOW-Williston,,Martin Aguilar,Devon Energy,Tri-V Tool & Mfg Co,XC Bridged Mini Bulkheads w/ Wire Harness ASM,Go Wireline LLC,7vRibsPobT4GuNdhpITrC4,"On May 17, 2026, a misrun incident occurred at the GOW-Williston site involving customer Go Wireline LLC and operating company Devon Energy. The incident, which was categorized as a product defect, involved a loss of communication with toolstring switches due to an electrical leak path to ground in a spare barrel.",
564,5/16/2026,Closed,Low,Field,"Liberty High Peak
Engineer called saying he had an open circuit on gun 8 of 11. He said he could read the switch but was reading No detonator and had open firing circuit when shooting not getting any current. Skipped gun 8 and shot the remaining clusters. I asked him if it was reading yes on the detonator before and he said it was.  From what it told me he was reading yes attempted to shoot then after the first attempt the system read the switch with no det. I told him it kind of sounds like the det may have possibly fired the first attempt and maybe low ordered. He told me he didn't see any breaks on the first attempt then I had him look at the first shot log and he said it did look like the current came up and broke. Waiting on him to send me the shot plot.",Jacob,,A6H,53,"Midland, TX",DSX,XFire,Yes,Misfire,Yes,,"When attempting to shoot gun 8 the Spartan system read No for detonator and had an open circuit when applying voltage. Several attempts were made to fire gun 8 with no success. Gun 8 was skipped and guns 9, 10, and 11 were shot. Frac continued with 10/11 clusters shot.",Once on surface the gun was set to the side until management arrived. The switch was reading but still reading no det.,It was found that the purple wire terminal on the detonator side of the molex connector had came unseated and caused and open circuit from the detonator to the switch.,https://www.appsheet.com/image/getimageurl?appName=FieldServiceTracker-657421423&tableName=Incident&fileName=Incident_Images%2FFbwOXRu7ZP4mIE6NvJrJi5.Image1.004340.jpg&appVersion=1.000984&signature=85454a9d65c5373f2476814c5ee48bdf24fd296de91649b0f41cc1f336e5f4c1,https://www.appsheet.com/image/getimageurl?appName=FieldServiceTracker-657421423&tableName=Incident&fileName=Incident_Images%2FFbwOXRu7ZP4mIE6NvJrJi5.Image2.004340.jpg&appVersion=1.000984&signature=1d2e6e4f85613a6470a02eb578ee5cd2a720b6abd53f048f7425445f034d7fda,https://www.appsheet.com/template/gettablefileurl?appName=FieldServiceTracker-657421423&tableName=Incident&fileName=Incident_Files_%2FFbwOXRu7ZP4mIE6NvJrJi5.Incident%20Report.021307.docx&appVersion=1.000984&signature=5ae638e818fd77d1b78c90ea8309cd3e9cf11090f67db23696fd03ef5f5657ed9506a9e6bd30ff5589ea9a9989e9d9eb,,https://xconnecthq.slack.com/archives/C02CST5QZC3/p1778986741489179?thread_ts=1778986741.489179&cid=C02CST5QZC3,LES-West Texas,1724,Eric Williams,HighPeak Energy,Tri-V Tool & Mfg Co,Click-In Detonator - A140S (XConnect) ASM,Liberty Energy Inc.,7vRibsPobT4GuNdhpITrC4,"On May 16, 2026, a misfire incident occurred during operations for Liberty Energy Inc. and HighPeak Energy. Gun 8 failed to fire due to an open circuit and was skipped. The root cause was identified as a product defect: a purple wire terminal in the molex connector was unseated.",
563,5/16/2026,Closed,Moderate,Facility,"Liberty SM
Had a misfire due to terminal releasing from Detonator Molex this time.",,,,,,,,Yes,Misfire,Yes,,When attempting to fire the selection an open cicuit was detected on the detonator. Failing to fire the gun,Upon reaching surface it was observed that the terminal had deseated from the molex connection on the detonator side.,Still under investigation but it is alleged that the same issue we are having with the female molex version on the pre-wired switches.,https://www.appsheet.com/image/getimageurl?appName=FieldServiceTracker-657421423&tableName=Incident&fileName=Incident_Images%2FtgiBgtJqDD4wi5Dyzr1oLc.Image1.145922.jpg&appVersion=1.000984&signature=7a51efa91b5fba07a8f628ac9eed84220c842e848d621331630b7cb55478a1a2,,,,https://xconnecthq.slack.com/archives/C02CST5QZC3/p1778943575514669,LES-Platteville,,Robert Grissom,SM Energy,,RL XFire Combo Switch - Wired Harness 3/5 ASM,Liberty Energy Inc.,7vRibsPobT4GuNdhpITrC4,"On May 16, 2026, a misfire incident occurred for Liberty Energy Inc. (SM Energy) in the LES-Platteville district. The incident involved an open circuit on a detonator, preventing the gun from firing, which was traced to a terminal deseating from its molex connection. The root cause is still under investigation, but it is suspected to be related to a recurring issue with female molex connections.",
