325,12/26/2024,Closed,,Field,,Na,,Steinmann Unit B8,10,"Midland, TX",RAIL,XFire,Yes,Misfire,Yes,SO#,During the firing process of gun 3 no current or break was observed. Multiple attempts were made with no success. After the last attempt the software indicated No during the deto detection.,"Once on surface the test box would not detect the detonator. The detonator read the correct ohms with blaster meter. After looking at the molex connector on the switch, the green wire wasn’t pushed into the connector all the way which created an open circuit to the detonator.","Talk with the manufacturer about testing these at the factory.

Have gun builders at the shop pull testing these the connections prior to sending out.

Talk to customer about having crews in the field do a light pull test after the detonator is clicked in.",https://www.appsheet.com/image/getimageurl?appName=FieldServiceTracker-657421423&tableName=Incident&fileName=Incident_Images%2F12-30-2024%2009-50-06.Evidence.170349.jpg&appVersion=1.000984&signature=7f01b54e1aef0c5f9481510281fdbcae111c1b1d0b8244b1fc918fe44a6995ee,,https://www.appsheet.com/template/gettablefileurl?appName=FieldServiceTracker-657421423&tableName=Incident&fileName=Incident_Files_%2F12-30-2024%2009-50-06.Incident%20Report.170350.docx&appVersion=1.000984&signature=5db141b1b80771f0c7764f53d983059222b9eda38144bd8a3d224c5ef47f70a9a276b69f500a9ca1552c3fa09be2806f,,,HWS-Victoria,,Eric Williams,ConocoPhillips,,,Horizontal Wireline Services,7vRibsPobT4GuNdhpITrC4,,hat4Rmj6jZ4KAShx77Yfz1
324,12/28/2024,Closed,,Field,I received 2 bad single switches back from the field. These were caught in the perf trailer while checking the gun string with the test box. They appear to be two different circuit board types.,,,,,"Williston, ND",RAIL,XFire,Yes,Surface,Inconclusive,SO#,2 Bad XFire single switches caught in the perf trailer.,"*Switch 4096*
• *Does not read*
• *Over current detected*
This leads me to think there is a short between white and ground. I have not been able to pick it up with a multimeter. I believe this means the short is after communication to the switch starts.

There are couple reasons for voltage regulator to fail:
1- switch was shot many times
2- switch was exposed to high voltage
3- component was bad
4- switch was exposed to esd( again high voltage spike)
*Switch 3976*
• *Reads by itself* 
• *Once a switch is below it, it will not read either.*
• *No switches found or Time out from the test box*
I believe this means a leak between the white and blue wires on the switch. Again, I was not able to pick this up with a multimeter.

Possible reasons;
switch was exposed to high current for too long
Switch was shot too many times
component failure",Replace the guns on location.,https://www.appsheet.com/image/getimageurl?appName=FieldServiceTracker-657421423&tableName=Incident&fileName=Incident_Images%2F12-28-2024%2022-58-18.Evidence.231054.jpg&appVersion=1.000984&signature=5ea48461459b866fd59f67dc2641b0fa305423fb37fd00c9a5f55999e87310c7,,,,https://xconnecthq.slack.com/archives/C02CST5QZC3/p1735426698028439?thread_ts=1735426698.028439&cid=C02CST5QZC3,GOW-Williston,,Kelly Sullivan,Phoenix Operating LLC,Advanced Wireline Solutions Inc,XC XFire Switch,Go Wireline LLC,7vRibsPobT4GuNdhpITrC4,,
323,12/20/2024,Closed,,Facility,Picked up subs and gun where Bulkhead failed and flooded gun,TWG OXY,,,,"Williston, ND",RAIL,XFire,Yes,Misfire,Yes,SO#,Flooded gun.,Bulkhead was observed to have been cut by pressure,Possibly TriV is using a smaller ORing than adequate,https://www.appsheet.com/image/getimageurl?appName=FieldServiceTracker-657421423&tableName=Incident&fileName=Incident_Images%2F12-22-2024%2018-00-54.Evidence.165751.jpg&appVersion=1.000984&signature=0cbe8264bb53914c0a8d3a10d806ec52fef6672255e6e2693e234e881012d0b1,,https://www.appsheet.com/template/gettablefileurl?appName=FieldServiceTracker-657421423&tableName=Incident&fileName=Incident_Files_%2F12-22-2024%2018-00-54.Incident%20Report.165730.pdf&appVersion=1.000984&signature=3cbe94a27a321ce320741ef245b59800daf3cd36218086e225d92cf7760b72dec91744986bba346ed51537238b7f7ed3,,,TWG-Windsor,449,Robert Grissom,Occidental Petroleum Corp,Tri-V Tool & Mfg Co,RL/RC Bulkhead ASM,The Wireline Group,7vRibsPobT4GuNdhpITrC4,,
321,12/21/2024,Closed,,Facility,Nate called saying Pintail DBK3 had a misrun. He said that the detonator went but the detonator cord did not initiate.,Pintail/DBK3/Kilgore,,,,"Midland, TX",RAIL,XFire,No,Misfire,No,SO#,Nate called saying Pintail DBK3 had a misrun. He said that the detonator went but the detonator cord did not initiate.,There was minimal damage to the det cord but the detonator appears to have fully initiated. Based off of the position of the remaining detonator and the minimal damage to the detonator cord; it appears the operator did not ensure the detonator was properly seated in the detonator clip.,Spoke with Pintail FSM and explained the issue and the importance of fully seating the detonator inside the detonator clip.,https://www.appsheet.com/image/getimageurl?appName=FieldServiceTracker-657421423&tableName=Incident&fileName=Incident_Images%2F12-21-2024%2021-03-18.Evidence.030909.jpg&appVersion=1.000984&signature=27ccb4d21931a61b873eb97a0947ce373514dd4edcbac7c903293a9c19c4feb7,,https://www.appsheet.com/template/gettablefileurl?appName=FieldServiceTracker-657421423&tableName=Incident&fileName=View%20Report%20for%20Event%20321&appVersion=1.000984&signature=e1d8a0b452f3a6ca9b36f09f7188c60c1a6f6ed3077a27bb683c529d18892f1534b6fc44b08d49c2e8be89b65e46f7cc,,,PIN-Midland,,Theo Morris,"Diamondback Energy, Inc.",Austin Powder Company,,Pintail Completions,,"On December 21, 2024, a misfire incident was reported by Pintail Completions (Diamondback Energy, Inc.) in the PIN-Midland district. The detonator fired but the cord did not initiate. Investigation concluded the detonator was not properly seated, and the issue has been discussed with the Pintail FSM.",
320,12/10/2024,Closed,Critical,Facility,After setting the plug and shooting gun 1 the engineer received an open circuit message from AWS software. He was unable to regain communication and the decision was made to skip gun 2 and shoot the remaining guns.,Horizontal/Nights/,,A2,5,"Midland, TX",RAIL,XFire,Yes,Misfire,Yes,SO#,After setting the plug and shooting gun 1 the engineer received an open circuit message from AWS software. He was unable to regain communication and the decision was made to skip gun 2 and shoot the remaining guns.,"While attempting to read the switch at the XConnect facility the open circuit repeated itself in the gun
barrel and once the Rail was removed.
• The Rail was removed, and the switch was verified successfully on its own.
• While inspecting the Scotch-Lock connections and wiring in the rail; the ground wire connection from
the switch to the rail was loose.
o The black ground wire was not fully seated in the crimp causing an intermittent ground that
allowed the switch to check successfully on surface but failed downhole.",Follow up with manufacturer and revisit the QC process.,https://www.appsheet.com/image/getimageurl?appName=FieldServiceTracker-657421423&tableName=Incident&fileName=Incident_Images%2F12-20-2024%2015-29-33.Evidence.000906.jpg&appVersion=1.000984&signature=d8096c53d152834bb05c24de12b5376c41624a69081caee889e96ad4ba172f87,,https://www.appsheet.com/template/gettablefileurl?appName=FieldServiceTracker-657421423&tableName=Incident&fileName=Incident_Files_%2F12-20-2024%2015-29-33.Incident%20Report.000906.pdf&appVersion=1.000984&signature=7470c0ec288b4ece6af713d2e3bcdf9612ffa1003a8a33c199d7dae297dbfd86688fdc95faa31605b7ab90a18644fe4c,,,HWS-Victoria,,Theo Morris,ConocoPhillips,,,Horizontal Wireline Services,7vRibsPobT4GuNdhpITrC4,,
319,12/20/2024,Closed,,Field,Pintail supervisor called stating he had reached plug depth and received a short at gun 4 when trying to read the tool string and arm the plug switch. All trouble shooting steps were tried without success. The decision was made to POOH.,Pintail/DBK1/Days/Kilgore,,E 16WA,11,"Midland, TX",RAIL,XFire,Yes,Misrun,Yes,SO#,Pintail supervisor called stating he had reached plug depth and received a short at gun 4 when trying to read the tool string and arm the plug switch. All trouble shooting steps were tried without success. The decision was made to POOH.,"•	Once on surface the tool string still showed an “overcurrent” when checking with the verify box.
•	This short was occurring after the switch and detonator were verified but would not communicate with gun 3.
•	Once gun 4 was removed from the tool string there was evidence of metal shavings in the internal barrel threads as well as some on the tandem sub.
•	The verify box still showed an “overcurrent” on gun 4 when it was tested by itself. 
•	All Scotch-Locks were properly connected, and there were no damaged wires upon initial inspection.
•	After removing the switch cover and wire strap; more metal shavings were discovered on the green, blue, and white wires.
•	After the shavings had been removed the Rail assembly tested successfully with the verify box.
•	The gun and subs were taken back to XConnect for further investigation","At the XConnect facility, none of the “overcurrent” readings were repeated and the switch tested successfully. After breaking down the Rail component-by-component a small cut was observed in the blue wire of the bottom bulkhead. This cut is where the short was occurring and explains why the switch and detonator were being seen on the verify box and unable to communicate with the next gun.",https://www.appsheet.com/image/getimageurl?appName=FieldServiceTracker-657421423&tableName=Incident&fileName=Incident_Images%2F12-20-2024%2013-46-09.Evidence.000846.jpg&appVersion=1.000984&signature=a8b40d4ac70a89c056561d7c6cac6fb0d00e34bc390b93b435cbf61c6f70ad5f,,https://www.appsheet.com/template/gettablefileurl?appName=FieldServiceTracker-657421423&tableName=Incident&fileName=Incident_Files_%2F12-20-2024%2013-46-09.Incident%20Report.000846.pdf&appVersion=1.000984&signature=6f7fea9256bfba478e8e57cf5a2243572cd83fa005665950ee8fe24e38bd35e2a75d7bc85ec5e27aa3cf28e5bf2f272c,,,PIN-Midland,443,Theo Morris,"Diamondback Energy, Inc.",Tri-V Tool & Mfg Co,"RL Insulator w/ 6"" Blue Wire",Pintail Completions,7vRibsPobT4GuNdhpITrC4,,
318,12/14/2024,Closed,,Facility,"Brought back 12 guns from DBK3.

1 was missing a wave spring.

1 needs new sub.

1 was dropped and needs to be rebuilt.

1 had a bent rail.

The remaining six looked and verified good.",Pintail DBK3,,N/A,,"Midland, TX",RAIL,XFire,Yes,Other,No,SO#,,,,,,,,,PIN-Midland,,Theo Morris,"Diamondback Energy, Inc.",,,Pintail Completions,mF3zPy37464myrdSyX7Dub,,
317,12/15/2024,Closed,,Field,The engineer had good switch checks until after tying in. Then he was unable to read past gun 7 (showing a short).,Pintail/DBK3/David,,X24WB,87,"Midland, TX",RAIL,XFire,Inconclusive,Misrun,Inconclusive,SO#,The engineer had good switch checks until after tying in. Then he was unable to read past gun 7 (showing a short).,"After pulling string back to surface gun 7 was flooded. All O-rings were in place and could not find any damaged O-ring or any debris in the O-ring seat. The barrels were loose, I was able to take one off by hand. The barrel doesn’t appear to be egg shaped or any issue with the sub at first glance.",Will have the subs and barrel pressure tested tomorrow.,https://www.appsheet.com/image/getimageurl?appName=FieldServiceTracker-657421423&tableName=Incident&fileName=Incident_Images%2F12-15-2024%2006-06-42.Evidence.121135.jpg&appVersion=1.000984&signature=a81b9c354888b1b1a93e9b38f8c2a836a93b68db730dfce75fdb897890a0c4b1,,https://www.appsheet.com/template/gettablefileurl?appName=FieldServiceTracker-657421423&tableName=Incident&fileName=View%20Report%20for%20Event%20317&appVersion=1.000984&signature=b986acb9a338c59affc571b248fb7fa8e5d108e81727d5a5fb65bdc42cce4f237d7e993a1fa399cf4a4f48c2bf40979f,,,PIN-Midland,440,Theo Morris,"Diamondback Energy, Inc.",,,Pintail Completions,mF3zPy37464myrdSyX7Dub,"A 'Misrun' incident occurred on December 15, 2024, where an engineer was unable to read past gun 7 due to a short. Initial investigation found gun 7 flooded and loose barrels. Pressure testing of the subs and barrel is scheduled for tomorrow to determine the root cause.","890cjddRuB4PqzYGmdE0u2 , LrTGEWT5LF4PEt7DYnxSN1 , KhyNsQCsPJ4RiRzK0eLAN2"
316,12/12/2024,Closed,,Field,"DBK1 called saying they lost communication after shooting gun 4. Had them restart the computer, panel, etc. with no luck. They tried reading switches through slips with test box and could not communicate. Sounds like an issue in the BRT again but they have been unable to troubleshoot since they have made it back to surface. Heading that way.",Pintail/DBK1/Nights/Plines,,6JS,28,"Midland, TX",RAIL,XFire,No,Misrun,No,SO#,"DBK1 called saying they lost communication after shooting gun 4. Had them restart the computer, panel, etc. with no luck. They tried reading switches through slips with test box and could not communicate.","It looks like they had an intermittent open in the BRT. We were not able to read switches with the verify box through the brt. Removed the brt and we’re seeing an open with the box. They bounced the brt around and got an overcurrent, bounced it again and were able to read the switch.",None at this time,,,https://www.appsheet.com/template/gettablefileurl?appName=FieldServiceTracker-657421423&tableName=Incident&fileName=View%20Report%20for%20Event%20316&appVersion=1.000984&signature=8fbaa798c229bc1ef8f157397cb325492c154c748ba9a29ac55a096e7450fb8669ff8568715ba9a2ece9ac3f119efd30,,,PIN-Midland,436,Theo Morris,"Diamondback Energy, Inc.",,,Pintail Completions,7vRibsPobT4GuNdhpITrC4,"On December 12, 2024, a Misrun incident was reported by Diamondback Energy, Inc. (customer: Pintail Completions). The incident involved a loss of communication after shooting gun 4, with initial troubleshooting pointing to an intermittent open in the BRT. A root cause has not yet been determined.",
315,12/9/2024,Closed,,Field,Combo barrel would not read correct ignitor resistance.,Ryan Buck,,Pladson 4-9,n/a,"Williston, ND",RAIL,XFire,Yes,Surface,Yes,SO#,"A Combo switch would not read the correct ignitor resistance. This was found in the trailer.  

I've also updated their software to 21.6 and test box to 5.2.","We tried multiple firing heads, a stand alone resistor, checked and moved grounding around. Would consistently read open or 3 ohms. I swapped out the switch and it read good.",I swapped out the switch and it read good.,https://www.appsheet.com/image/getimageurl?appName=FieldServiceTracker-657421423&tableName=Incident&fileName=Incident_Images%2F12-10-2024%2022-26-32.Evidence.032338.jpg&appVersion=1.000984&signature=48bafae55677fae31945300db14077811ea7e6f9d70be3495a59044988c6fa3c,,,,https://xconnecthq.slack.com/archives/C02CST5QZC3/p1733869592890259?thread_ts=1733869592.890259&cid=C02CST5QZC3,GOW-Williston,433,Kelly Sullivan,Phoenix Operating LLC,Advanced Wireline Solutions Inc,RL XFire Combo Switch - Wired Harness 3/5 ASM,Go Wireline LLC,7vRibsPobT4GuNdhpITrC4,,
314,12/9/2024,Closed,,Field,Horizontal Conoco lost 3 guns down hole on a 2.75” refrac job. I’m at a loss to how or what caused this.,Horizontal/Conoco/Jason Turner,,A2,2,"Midland, TX","XC 2.75""",XFire,No,Misrun,No,SO#,"•	WL engineer RIH on stage 2 of the A2, had good switch scan multiple times in the well, and sat down at approximately 11,923’ on his first attempt to pump down (below 60 degrees). He was pumping 12 bpm @ max of 4500 #’s.
•	He picked up at 2,000 #’s.
•	WL engineer made a second attempt at the same rate and approximate pressure and sat down 193’ higher at 11,730’ (above 60 degrees).
•	He picked up at 2,650 #’s sticking slightly.
•	WL engineer made a third attempt at the same rate and pressure and sat down 28’ higher than the second attempt at 11,702’.
•	He picked up at 1,800 #’s.
•	WL engineer made a fourth and final attempt at the same rate and pressure and sat down deeper than the second and third attempts at 11,918’.
•	He picked up at 2,100#’s.
•	While POOH the engineer checked switches and received a short after switch four showing a BRT and 5 guns.
•	Once on surface the crew discovered that the third gun’s barrel had separated just below the sub above. Leaving two full guns, the partial third gun, and the pump down sub in the hole.","•	During the initial frac of Stage 1 pressure dropped from ~8,000 #’s to ~4,000 #’s while pumping.
•	A Dark Vision log has been run on the well and they determined there is damage to the casing. 
•	While the engineer was pumping 12 bpm in 4” he was unable to make it past 60 degrees on any attempt.
•	There have been two previous instances of severe barrel damage (Reference investigation reports dated: 10/21/2024 & 11/08/2024) that show excessive degradation of the metal potentially caused by damaged casing, stuck tools, and fluid/sand jetting.
•	All the detonator blocks in the five returned barrels were melted and there were other indications of excessive heat on other components including melting of the glue in the charge liners.","After examining this event and the two prior events; we believe that while down hole the gun string was subjected to excessive heat and pressure due to the damaged casing. This heat and pressure were enough to weaken the metal of the barrel on gun three to rapidly fail causing the separation of the barrel. In turn this caused an increase in pressure inside the barrel which crushed the internal gun components. Which explains the damage to the top end plate and the partially damaged charge casing that was retrieved in the junk basket run. The top end plate was not damaged in the same manner that is seen with a nominal detonation of a gun and showed similar markings from the previous barrels that had been eroded by pressure. In the previous instances the damage most likely occurred immediately after the guns had been fired or the moment guns were fired, which allowed for the jetting to flow through the perforations and prevented the same failure of the barrel as in this event.",https://www.appsheet.com/image/getimageurl?appName=FieldServiceTracker-657421423&tableName=Incident&fileName=Incident_Images%2F12-09-2024%2015-15-07.Evidence.013649.jpg&appVersion=1.000984&signature=3097b6bde9a16e4afb22217c18528fa3d356ce39f8cd76732ca7c31ba5c474aa,,https://www.appsheet.com/template/gettablefileurl?appName=FieldServiceTracker-657421423&tableName=Incident&fileName=Incident_Files_%2F12-09-2024%2015-15-07.Incident%20Report.013649.pdf&appVersion=1.000984&signature=a231599274603184df1e9dbdebb6ef85572d7bd1a9f0197ae2e19f8a7560bc055dae7214198eed2c26129374e6403457,,https://xconnecthq.slack.com/archives/C02CST5QZC3/p1733757307187159?thread_ts=1733757307.187159&cid=C02CST5QZC3,HWS-Victoria,,Austin English,ConocoPhillips,,"XC2.75 3 Shot Banded BBL (18"")",Horizontal Wireline Services,mF3zPy37464myrdSyX7Dub,,"aBYkLQ7NPH4um7oPfEDRPd , yN_FqAC5sm4mUGilov60G3 , jgxxqiIfMi4WeMhuzKmN-4"
313,12/11/2024,Closed,,Field,"Got a call from Nate at Pintail. They were unable to set a plug and the resistance went to 25 ohms after the first attempt. They had already started POOH when they called. I got a hold of the engineer and explained what I thought it was and the company man let him pump back down and they set the plug successfully. It was a Probe shooting panel this time, Rail, and Mach 33 Ignitor.",Pintail/Days/Kilgore,,Abu Garcia X 24 WB,68,"Midland, TX",RAIL,XFire,No,Other,No,SO#,Got a call from Nate at Pintail. They were unable to set a plug and the resistance went to 25 ohms after the first attempt.,They had already started POOH when they called. I got a hold of the engineer and explained what I thought it was and the company man let him pump back down and they set the plug successfully. It was a Probe shooting panel this time.,It appears that the resistor burned but current was not held long enough to fully break the resistor. We will be making a preliminary bulletin to distribute to the crews on the proper shooting profile for firing the Mach 33.,https://www.appsheet.com/image/getimageurl?appName=FieldServiceTracker-657421423&tableName=Incident&fileName=Incident_Images%2F12-11-2024%2014-15-05.Evidence.202043.jpg&appVersion=1.000984&signature=823ca129ce5353ca10a949aa95caff7d88df2934cf6e9801bf299aecde1c5e37,,https://www.appsheet.com/template/gettablefileurl?appName=FieldServiceTracker-657421423&tableName=Incident&fileName=View%20Report%20for%20Event%20313&appVersion=1.000984&signature=05eac228286d0f68156394210392a7e289af67e1e487bc71c89377fe56a6c590dca006db286e22e5a68c198e73d690f9,,,PIN-Midland,432,Theo Morris,"Diamondback Energy, Inc.",Diamondback Industries,Ignitors - Mach 33 ASM,Pintail Completions,,"An incident occurred on December 11, 2024, involving Pintail Completions and Diamondback Energy, Inc. The issue was an inability to set a plug, with resistance going to 25 ohms. The problem was resolved, and the plug was successfully set after pumping back down. The root cause appears to be a resistor burning without sufficient current. A preliminary bulletin will be issued to crews on the proper shooting profile for the Mach 33.",
312,12/7/2024,Closed,,Field,Misrun due to exposed brass on the mini bridge.,89energy/days/ na,,34,34,"Midland, TX",XC,XFire,Yes,Misrun,Yes,SO#,Set the plug and shot 1 gun and had a short detected on gun 9. The engineer was able to shoot 2 more guns while detecting an intermittent short. Unfortunately no more guns were able to be shot. They proceeded to pull out of the well and run in with a new gun string.,During the investigation it was found that there was exposed brass on the mini bridge. This in turn caused a short in the tool string.,Will check with vendor to ensure the quality of the product . Also the connection will be metered in house during the gun building process.,https://www.appsheet.com/image/getimageurl?appName=FieldServiceTracker-657421423&tableName=Incident&fileName=Incident_Images%2F12-11-2024%2008-36-26.Evidence.144349.jpg&appVersion=1.000984&signature=8230b42465d8c03eb5dfee771099f5e95436d5c31ba41c6f13a15b1190181a64,,https://www.appsheet.com/template/gettablefileurl?appName=FieldServiceTracker-657421423&tableName=Incident&fileName=Incident_Files_%2F12-11-2024%2008-36-26.Incident%20Report.220955.docx&appVersion=1.000984&signature=b149666b80a873d2624bc1c57dc0e4c5baf29b5cdf9091f66e13f3ea7da555f1a33b0d260924903b988e0ba7455a7f71,,,TIER-Oklahoma,,Mike Grober,89 Energy,,"XC Bridged Mini Bulkheads 4"" ASM","Tier 1 Completions Solutions, Inc.",7vRibsPobT4GuNdhpITrC4,,
311,12/6/2024,Closed,,Field,Had one cluster in two different stages that didn’t shoot and showed a short when attempting to shoot.,Gabe,,Pimento 106H,39,"Midland, TX",XC,Control Fire,Yes,Misfire,Yes,SO#,Failed mini-bridge,Brass protruding through on the detonator side of the mini- bridge which created a short circuit when attempting to fire.,Start using High voltage meter checks on Mini-bridges before they are installed into the end plates.,https://www.appsheet.com/image/getimageurl?appName=FieldServiceTracker-657421423&tableName=Incident&fileName=Incident_Images%2F12-10-2024%2010-34-36.Evidence.170843.png&appVersion=1.000984&signature=95efe12de3f5da14879cc8b5f7b8368a8abbca71a360385b7b3763a274f4d28f,,https://www.appsheet.com/template/gettablefileurl?appName=FieldServiceTracker-657421423&tableName=Incident&fileName=Incident_Files_%2F12-10-2024%2010-34-36.Incident%20Report.170843.docx&appVersion=1.000984&signature=f0d47e8d75c86ae10b653292d796c511fc073771557bf31b0e0d34563cdbbc477c13772d8bdee94ba84014de5eb4dab9,,,KLX-Midland,,Eric Williams,Matador Resources Company,,,KLX Energy Services,7vRibsPobT4GuNdhpITrC4,,
310,12/9/2024,Closed,,Field,Short detected in the gun string.,TWG/Prairie Recourses/NA,,1E,37,"Midland, TX",XC,XFire,Yes,Misrun,Yes,SO#,Could not set the plug due to a short being detected in the gun string.,There was a piece of exposed brass on the mini bridge connection.,Will check with vendor to ensure the quality of the product . Also the connection will be metered in house during the gun building process.,https://www.appsheet.com/image/getimageurl?appName=FieldServiceTracker-657421423&tableName=Incident&fileName=Incident_Images%2F12-10-2024%2009-42-52.Evidence.155207.jpg&appVersion=1.000984&signature=b5a7af08bdddd5dfd698d80c53df2348300ca20570b57490a43ee4df83d0c689,,https://www.appsheet.com/template/gettablefileurl?appName=FieldServiceTracker-657421423&tableName=Incident&fileName=Incident_Files_%2F12-10-2024%2009-42-52.Incident%20Report.155207.docx&appVersion=1.000984&signature=9c7aaf2988dd822b60994f571676ae2f9d44837b5c8882351f25ab7702644a4c8d00f46e5b0dfea2c8b87e0bd4d293f6,,,TWG-Windsor,,Mike Grober,,Tri-V Tool & Mfg Co,"XC Bridged Mini Bulkheads 4"" ASM",The Wireline Group,7vRibsPobT4GuNdhpITrC4,,
